id,altmetric_score,title,journal_name,print_issn,online_issn,subjects,affiliation,publication_date,doi,news,blog,policy,patent,twitter,peer_review,weibo,facebook,wikipedia,google,linkedIn,reddit,pinterest,f1000,qa,videos,syllabi,mendeley,dimensions_citations,details_page,badge_url
"142506","0","Modelling Insurance Data with the Pareto Arctan Distribution","Astin Bulletin","0515-0361","","01 Mathematical Sciences; 0104 Statistics","University of Las Palmas de Gran Canaria; University of Melbourne","19-06-2015","10.1017/asb.2015.9","0","0","0","0","0","0","0","0","0","0","0","0","0","0","0","0","0","10","6","https://www.altmetric.com/details/8067808","https://api.altmetric.com/v1/donut/8067808_240.png"
"142547","0","The Efficient Computation and the Sensitivity Analysis of Finite-Time Ruin Probabilities and the Estimation of Risk-Based Regulatory Capital","Astin Bulletin","0515-0361","","01 Mathematical Sciences; 0104 Statistics; 15 Commerce, Management, Tourism and Services; 1502 Banking, Finance and Investment","Monash University; University of Melbourne","03-03-2016","10.1017/asb.2016.5","0","0","0","0","0","0","0","0","0","0","0","0","0","0","0","0","0","0","0","https://www.altmetric.com/details/7613388","https://api.altmetric.com/v1/donut/7613388_240.png"
"142592","0","Correlations Between Insurance Lines of Business: An Illusion or a Real Phenomenon? Some Methodological Considerations","Astin Bulletin","0515-0361","","14 Economics; 1402 Applied Economics; 1403 Econometrics; 15 Commerce, Management, Tourism and Services; 1502 Banking, Finance and Investment","University of Montreal","27-01-2016","10.1017/asb.2015.31","0","0","0","0","0","0","0","0","0","0","0","0","0","0","0","0","0","5","4","https://www.altmetric.com/details/6990264","https://api.altmetric.com/v1/donut/6990264_240.png"
"142710","0","International Cause-Specific Mortality Rates: New Insights from a Cointegration Analysis","Astin Bulletin","0515-0361","","14 Economics; 1402 Applied Economics","University of Lausanne; UNSW Sydney","29-12-2015","10.1017/asb.2015.24","0","0","0","0","0","0","0","0","0","0","0","0","0","0","0","0","0","5","3","https://www.altmetric.com/details/6027397","https://api.altmetric.com/v1/donut/6027397_240.png"
"144488","7","Computer-aided definition of sizing procedures and optimization problems of mechatronic systems","Concurrent Engineering: Research & Applications","1063-293X"," 1531-2003","01 Mathematical Sciences; 0103 Numerical and Computational Mathematics","University of Toulouse","25-05-2015","10.1177/1063293x15586063","1","0","0","0","0","0","0","0","0","0","0","0","0","0","0","0","0","9","3","https://www.altmetric.com/details/47127622","https://api.altmetric.com/v1/donut/47127622_240.png"
"146048","3","Template-based modeling methodology of a virtual plant for virtual commissioning","Concurrent Engineering: Research & Applications","1063-293X"," 1531-2003","08 Information and Computing Sciences; 0801 Artificial Intelligence and Image Processing","Ajou University","24-04-2014","10.1177/1063293x14531423","0","0","0","2","0","0","0","0","0","0","0","0","0","0","0","0","0","10","4","https://www.altmetric.com/details/41492317","https://api.altmetric.com/v1/donut/41492317_240.png"
"146107","3","Piecewise constant timed continuous PNs for the steady state estimation of stochastic PNs","Discrete Event Dynamic Systems","0924-6703"," 1573-7594","01 Mathematical Sciences; 0104 Statistics","University of Le Havre","14-07-2011","10.1007/s10626-011-0114-y","0","0","1","0","0","0","0","0","0","0","0","0","0","0","0","0","0","0","11","https://www.altmetric.com/details/20522819","https://api.altmetric.com/v1/donut/20522819_240.png"
"146114","3","Tight performance bounds in the worst-case analysis of feed-forward networks","Discrete Event Dynamic Systems","0924-6703"," 1573-7594","08 Information and Computing Sciences; 0802 Computation Theory and Mathematics; 10 Technology; 1005 Communications Technologies","?cole Normale Sup?rieure de Lyon","16-06-2015","10.1007/s10626-015-0213-2","0","0","0","0","0","0","0","0","1","0","0","0","0","0","0","0","0","18","1","https://www.altmetric.com/details/18922773","https://api.altmetric.com/v1/donut/18922773_240.png"
"146913","3","Product lifecycle management in design and engineering education: International perspectives","Concurrent Engineering: Research & Applications","1063-293X"," 1531-2003","13 Education; 1303 Specialist Studies In Education","Loughborough University; PTC (United States); Purdue University; University of Technology of Compi?gne","03-02-2014","10.1177/1063293x13520316","0","0","0","0","4","0","0","1","0","0","0","0","0","0","0","0","0","45","5","https://www.altmetric.com/details/2100344","https://api.altmetric.com/v1/donut/2100344_240.png"
"146979","2","On mapping tasks during product development","Concurrent Engineering: Research & Applications","1063-293X"," 1531-2003","08 Information and Computing Sciences; 0806 Information Systems","","12-02-2016","10.1177/1063293x15625098","0","0","0","0","2","0","0","0","0","0","0","0","0","0","0","0","0","7","8","https://www.altmetric.com/details/6135388","https://api.altmetric.com/v1/donut/6135388_240.png"
"147120","2","Actuator saturation and anti-windup compensation in event-triggered control","Discrete Event Dynamic Systems","0924-6703"," 1573-7594","01 Mathematical Sciences; 0102 Applied Mathematics","Royal Institute of Technology","27-09-2012","10.1007/s10626-012-0151-1","0","0","0","0","2","0","0","0","0","0","0","0","0","0","0","0","0","12","32","https://www.altmetric.com/details/53192288","https://api.altmetric.com/v1/donut/53192288_240.png"
"147144","2","Concurrent Engineering: Research and Applications (CERA)? An international Journal: Special issue on CloudIoT in Concurrent Engineering","Concurrent Engineering: Research & Applications","1063-293X"," 1531-2003","","","23-05-2017","10.1177/1063293x17711325","0","0","0","0","2","0","0","0","0","0","0","0","0","0","0","0","0","0","0","https://www.altmetric.com/details/21676137","https://api.altmetric.com/v1/donut/21676137_240.png"
"147155","2","Guest editorial: special issue on formal methods in control","Discrete Event Dynamic Systems","0924-6703"," 1573-7594","","University of California Los Angeles; University of Michigan?Ann Arbor","20-04-2017","10.1007/s10626-017-0246-9","0","0","0","0","2","0","0","0","0","0","0","0","0","0","0","0","0","3","2","https://www.altmetric.com/details/19535581","https://api.altmetric.com/v1/donut/19535581_240.png"
"148228","1","Knowledge-based engineering for multidisciplinary systems: Integrated design based on interface model","Concurrent Engineering: Research & Applications","1063-293X"," 1531-2003","08 Information and Computing Sciences; 0806 Information Systems","Northwestern Polytechnical University; University of Applied Sciences Upper Austria; University of Technology of Compi?gne","26-10-2017","10.1177/1063293x17734591","0","0","0","0","1","0","0","0","0","0","0","0","0","0","0","0","0","10","2","https://www.altmetric.com/details/28157252","https://api.altmetric.com/v1/donut/28157252_240.png"
"148236","1","A coordination method for concurrent design and a collaboration tool for parametric system models","Concurrent Engineering: Research & Applications","1063-293X"," 1531-2003","08 Information and Computing Sciences; 0806 Information Systems","Skolkovo Institute of Science and Technology","27-09-2017","10.1177/1063293x17732374","0","0","0","0","1","0","0","0","0","0","0","0","0","0","0","0","0","15","4","https://www.altmetric.com/details/26684815","https://api.altmetric.com/v1/donut/26684815_240.png"
"148310","1","Order-reduction abstractions for safety verification of high-dimensional linear systems","Discrete Event Dynamic Systems","0924-6703"," 1573-7594","08 Information and Computing Sciences; 0801 Artificial Intelligence and Image Processing; 0802 Computation Theory and Mathematics","The University of Texas at Arlington; Vanderbilt University","12-04-2017","10.1007/s10626-017-0244-y","0","0","0","0","1","0","0","0","0","0","0","0","0","0","0","0","0","5","3","https://www.altmetric.com/details/18764911","https://api.altmetric.com/v1/donut/18764911_240.png"
"148491","1","Additive layered manufacturing: State-of-the-art applications in product innovation","Concurrent Engineering: Research & Applications","1063-293X"," 1531-2003","09 Engineering; 0910 Manufacturing Engineering","Visvesvaraya National Institute of Technology","14-01-2016","10.1177/1063293x15613111","0","0","0","0","1","0","0","0","0","0","0","0","0","0","0","0","0","61","11","https://www.altmetric.com/details/5011434","https://api.altmetric.com/v1/donut/5011434_240.png"
"148832","1","Coordination control of discrete-event systems revisited","Discrete Event Dynamic Systems","0924-6703"," 1573-7594","20 Language, Communication and Culture; 2004 Linguistics","Institute of Mathematics","13-02-2014","10.1007/s10626-013-0179-x","0","0","0","0","3","0","0","0","0","0","0","0","0","0","0","0","0","18","19","https://www.altmetric.com/details/1629392","https://api.altmetric.com/v1/donut/1629392_240.png"
"149023","1","A Knowledge-based Master-model Approach with Application to Rotating Machinery Design","Concurrent Engineering: Research & Applications","1063-293X"," 1531-2003","09 Engineering; 0910 Manufacturing Engineering","Blekinge Institute of Technology; Lule? University of Technology; University of Agder; University of Michigan?Ann Arbor; Volvo (Sweden)","17-10-2011","10.1177/1063293x11424511","0","0","0","0","1","0","0","0","0","0","0","0","0","0","0","0","0","28","7","https://www.altmetric.com/details/484424","https://api.altmetric.com/v1/donut/484424_240.png"
"149430","1","Falsification of combined invariance and reachability specifications in hybrid control systems","Discrete Event Dynamic Systems","0924-6703"," 1573-7594","08 Information and Computing Sciences; 0803 Computer Software","Carnegie Mellon University","06-04-2017","10.1007/s10626-017-0241-1","0","0","0","0","2","0","0","0","0","0","0","0","0","0","0","0","0","4","2","https://www.altmetric.com/details/18725661","https://api.altmetric.com/v1/donut/18725661_240.png"
"149637","1","Computation of controllable and coobservable sublanguages in decentralized supervisory control via communication","Discrete Event Dynamic Systems","0924-6703"," 1573-7594","01 Mathematical Sciences; 0102 Applied Mathematics","Institute of Mathematics; TU Dresden","25-04-2017","10.1007/s10626-017-0249-6","0","0","0","0","2","0","0","0","0","0","0","0","0","0","0","0","0","8","1","https://www.altmetric.com/details/4865337","https://api.altmetric.com/v1/donut/4865337_240.png"
"150207","1","Fluid approximation of Petri net models with relatively small populations","Discrete Event Dynamic Systems","0924-6703"," 1573-7594","08 Information and Computing Sciences; 0806 Information Systems","University of Zaragoza","13-03-2017","10.1007/s10626-017-0238-9","0","0","0","0","1","0","0","0","0","0","0","0","0","0","0","0","0","2","2","https://www.altmetric.com/details/55675441","https://api.altmetric.com/v1/donut/55675441_240.png"
"150302","1","A framework for compositional nonblocking verification of extended finite-state machines","Discrete Event Dynamic Systems","0924-6703"," 1573-7594","08 Information and Computing Sciences; 0802 Computation Theory and Mathematics","Chalmers University of Technology; University of Waikato","12-09-2015","10.1007/s10626-015-0217-y","0","0","0","0","1","0","0","0","0","0","0","0","0","0","0","0","0","5","6","https://www.altmetric.com/details/24763806","https://api.altmetric.com/v1/donut/24763806_240.png"
"150353","1","KSim: An information system for knowledge management in Digital Factory","Concurrent Engineering: Research & Applications","1063-293X"," 1531-2003","08 Information and Computing Sciences; 0801 Artificial Intelligence and Image Processing","Claude Bernard University Lyon 1; Supm?ca","16-04-2017","10.1177/1063293x17702689","0","0","0","0","0","0","0","1","0","0","0","0","0","0","0","0","0","9","0","https://www.altmetric.com/details/19658922","https://api.altmetric.com/v1/donut/19658922_240.png"
"150609","1","Fault model identification and synthesis in Petri nets","Discrete Event Dynamic Systems","0924-6703"," 1573-7594","04 Earth Sciences; 0404 Geophysics","Laboratoire des Sciences de l'Information et des Syst?mes; University of Cagliari; University of Cyprus; University of Illinois at Urbana Champaign","10-06-2014","10.1007/s10626-014-0190-x","0","0","0","0","0","0","0","1","0","0","0","0","0","0","0","0","0","10","20","https://www.altmetric.com/details/3933118","https://api.altmetric.com/v1/donut/3933118_240.png"
"150883","1","Distributed supervisory control of discrete-event systems with communication delay","Discrete Event Dynamic Systems","0924-6703"," 1573-7594","01 Mathematical Sciences; 0102 Applied Mathematics","Northwestern Polytechnical University; Osaka City University; University of Toronto; Xi'an Jiaotong University","11-01-2015","10.1007/s10626-014-0208-4","0","0","0","0","0","0","0","0","0","0","0","1","0","0","0","0","0","15","10","https://www.altmetric.com/details/867999","https://api.altmetric.com/v1/donut/867999_240.png"
"150899","1","A functional approximation for the M/G/1/N queue","Discrete Event Dynamic Systems","0924-6703"," 1573-7594","01 Mathematical Sciences; 0103 Numerical and Computational Mathematics","University of B?ja?a; VU University Amsterdam","14-04-2012","10.1007/s10626-012-0135-1","0","0","0","0","1","0","0","0","0","0","0","0","0","0","0","0","0","2","10","https://www.altmetric.com/details/699892","https://api.altmetric.com/v1/donut/699892_240.png"
"150916","1","Modeling and control of switching max-plus-linear systems with random and deterministic switching","Discrete Event Dynamic Systems","0924-6703"," 1573-7594","01 Mathematical Sciences; 0102 Applied Mathematics","Delft University of Technology","07-12-2011","10.1007/s10626-011-0123-x","0","0","0","0","1","0","0","0","0","0","0","0","0","0","0","0","0","7","8","https://www.altmetric.com/details/487504","https://api.altmetric.com/v1/donut/487504_240.png"
"150989","0","Concurrent Conceptual Evaluation of Tolerances? Synthesis in Mechanical Design","Concurrent Engineering: Research & Applications","1063-293X"," 1531-2003","08 Information and Computing Sciences; 0806 Information Systems","Monterrey Institute of Technology and Higher Education; Universitat Polit?cnica de Catalunya; University of Girona; University of Holgu?n","20-06-2011","10.1177/1063293x11406147","0","0","0","0","0","0","0","0","0","0","0","0","0","0","0","0","0","10","4","https://www.altmetric.com/details/57851680","https://api.altmetric.com/v1/donut/57851680_240.png"
"151260","0","Sampled-data supervisory control","Discrete Event Dynamic Systems","0924-6703"," 1573-7594","08 Information and Computing Sciences; 0806 Information Systems","McMaster University","08-11-2013","10.1007/s10626-013-0172-4","0","0","0","0","0","0","0","0","0","0","0","0","0","0","0","0","0","6","2","https://www.altmetric.com/details/40934242","https://api.altmetric.com/v1/donut/40934242_240.png"
"151315","0","Computation of minimal event bases that ensure diagnosability","Discrete Event Dynamic Systems","0924-6703"," 1573-7594","01 Mathematical Sciences; 0102 Applied Mathematics","Federal University of Rio de Janeiro; University of Michigan?Ann Arbor","29-01-2012","10.1007/s10626-012-0129-z","0","0","0","0","0","0","0","0","0","0","0","0","0","0","0","0","0","15","21","https://www.altmetric.com/details/32925496","https://api.altmetric.com/v1/donut/32925496_240.png"
"151316","0","Special issue on recent trends in discrete event systems","Discrete Event Dynamic Systems","0924-6703"," 1573-7594","","Technical University of Berlin; University of Cagliari; University of Erlangen-Nuremberg; University of Michigan?Ann Arbor","29-08-2012","10.1007/s10626-012-0147-x","0","0","0","0","0","0","0","0","0","0","0","0","0","0","0","0","0","4","0","https://www.altmetric.com/details/32925485","https://api.altmetric.com/v1/donut/32925485_240.png"
"151317","0","Comparative analysis of related notions of opacity in centralized and coordinated architectures","Discrete Event Dynamic Systems","0924-6703"," 1573-7594","03 Chemical Sciences; 0306 Physical Chemistry (incl. Structural)","University of Michigan?Ann Arbor","06-09-2012","10.1007/s10626-012-0145-z","0","0","0","0","0","0","0","0","0","0","0","0","0","0","0","0","0","12","45","https://www.altmetric.com/details/32925483","https://api.altmetric.com/v1/donut/32925483_240.png"
"151318","0","Editorial: changes at J-DEDS","Discrete Event Dynamic Systems","0924-6703"," 1573-7594","","Hong Kong University of Science and Technology; Shanghai Jiao Tong University; University of Michigan?Ann Arbor","05-03-2015","10.1007/s10626-015-0211-4","0","0","0","0","0","0","0","0","0","0","0","0","0","0","0","0","0","1","0","https://www.altmetric.com/details/32925466","https://api.altmetric.com/v1/donut/32925466_240.png"
"151319","0","Special issue on recent advances in control of discrete event systems","Discrete Event Dynamic Systems","0924-6703"," 1573-7594","","Instituto Polit?cnico Nacional; University of Michigan?Ann Arbor; University of Zaragoza","22-02-2015","10.1007/s10626-015-0210-5","0","0","0","0","0","0","0","0","0","0","0","0","0","0","0","0","0","3","1","https://www.altmetric.com/details/32925465","https://api.altmetric.com/v1/donut/32925465_240.png"
"151320","0","Supervisory control for collision avoidance in vehicular networks using discrete event abstractions","Discrete Event Dynamic Systems","0924-6703"," 1573-7594","08 Information and Computing Sciences; 0801 Artificial Intelligence and Image Processing","Massachusetts Institute of Technology; Polytechnic University of Milan; University of California Los Angeles; University of Michigan?Ann Arbor","13-05-2016","10.1007/s10626-016-0228-3","0","0","0","0","0","0","0","0","0","0","0","0","0","0","0","0","0","31","4","https://www.altmetric.com/details/32925452","https://api.altmetric.com/v1/donut/32925452_240.png"
"151321","0","Supervisory control and reactive synthesis: a comparative introduction","Discrete Event Dynamic Systems","0924-6703"," 1573-7594","08 Information and Computing Sciences; 0801 Artificial Intelligence and Image Processing","Aalto University; German Research Centre for Artificial Intelligence; Rice University; University of Bremen; University of California, Berkeley; University of Michigan?Ann Arbor","15-03-2016","10.1007/s10626-015-0223-0","0","0","0","0","0","0","0","0","0","0","0","0","0","0","0","0","0","23","10","https://www.altmetric.com/details/32925448","https://api.altmetric.com/v1/donut/32925448_240.png"
"151324","0","Augmented finite transition systems as abstractions for control synthesis","Discrete Event Dynamic Systems","0924-6703"," 1573-7594","08 Information and Computing Sciences; 0802 Computation Theory and Mathematics","University of Michigan?Ann Arbor; University of Waterloo","31-03-2017","10.1007/s10626-017-0243-z","0","0","0","0","0","0","0","0","0","0","0","0","0","0","0","0","0","8","3","https://www.altmetric.com/details/32888832","https://api.altmetric.com/v1/donut/32888832_240.png"
"151327","0","Concurrency bugs in multithreaded software: modeling and analysis using Petri nets","Discrete Event Dynamic Systems","0924-6703"," 1573-7594","08 Information and Computing Sciences; 0802 Computation Theory and Mathematics","Georgia Institute of Technology; Hewlett-Packard (United States); University of Michigan?Ann Arbor","13-05-2012","10.1007/s10626-012-0139-x","0","0","0","0","0","0","0","0","0","0","0","0","0","0","0","0","0","7","22","https://www.altmetric.com/details/32837858","https://api.altmetric.com/v1/donut/32837858_240.png"
"151331","0","Erratum to: Diagnosis of discrete event systems using decentralized architectures","Discrete Event Dynamic Systems","0924-6703"," 1573-7594","","Hewlett-Packard (United States); Idaho National Laboratory; University of Michigan?Ann Arbor","05-04-2013","10.1007/s10626-013-0161-7","0","0","0","0","0","0","0","0","0","0","0","0","0","0","0","0","0","2","3","https://www.altmetric.com/details/32832044","https://api.altmetric.com/v1/donut/32832044_240.png"
"151402","0","On the use of product portfolio and variant maps as visualization tools to support platform-based development strategies","Concurrent Engineering: Research & Applications","1063-293X"," 1531-2003","08 Information and Computing Sciences; 0806 Information Systems","Norwegian University of Science and Technology","28-07-2016","10.1177/1063293x16654531","0","0","0","0","0","0","0","0","0","0","0","0","0","0","0","0","0","11","0","https://www.altmetric.com/details/31710176","https://api.altmetric.com/v1/donut/31710176_240.png"
"151416","0","Automated identification of distinct events in an assembly process using tracking of body postures","Concurrent Engineering: Research & Applications","1063-293X"," 1531-2003","08 Information and Computing Sciences; 0801 Artificial Intelligence and Image Processing","Indian Institute of Science Bangalore","25-12-2017","10.1177/1063293x17745941","0","0","0","0","0","0","0","0","0","0","0","0","0","0","0","0","0","3","0","https://www.altmetric.com/details/31124049","https://api.altmetric.com/v1/donut/31124049_240.png"
"151432","0","An integrated model for the environmental assessment of industrial products during the design process","Concurrent Engineering: Research & Applications","1063-293X"," 1531-2003","14 Economics; 1402 Applied Economics","University of Calabria","05-09-2017","10.1177/1063293x17729000","0","0","0","0","0","0","0","0","0","0","0","0","0","0","0","0","0","9","0","https://www.altmetric.com/details/29924070","https://api.altmetric.com/v1/donut/29924070_240.png"
"151438","0","An accelerated stopping rule for the Nested Partition Hybrid Algorithm for discrete stochastic optimization","Discrete Event Dynamic Systems","0924-6703"," 1573-7594","01 Mathematical Sciences; 0102 Applied Mathematics","VU University Amsterdam","10-04-2014","10.1007/s10626-014-0191-9","0","0","0","0","0","0","0","0","0","0","0","0","0","0","0","0","0","6","1","https://www.altmetric.com/details/29731913","https://api.altmetric.com/v1/donut/29731913_240.png"
"151440","0","Sensitivity analysis of ranked data: from order statistics to quantiles","Discrete Event Dynamic Systems","0924-6703"," 1573-7594","01 Mathematical Sciences; 0102 Applied Mathematics; 0104 Statistics","VU University Amsterdam","01-06-2014","10.1007/s10626-014-0192-8","0","0","0","0","0","0","0","0","0","0","0","0","0","0","0","0","0","5","2","https://www.altmetric.com/details/29731449","https://api.altmetric.com/v1/donut/29731449_240.png"
"151452","0","Perturbation analysis of waiting times in the G/G/1 queue","Discrete Event Dynamic Systems","0924-6703"," 1573-7594","01 Mathematical Sciences; 0104 Statistics","Leiden University; VU University Amsterdam","29-08-2012","10.1007/s10626-012-0144-0","0","0","0","0","0","0","0","0","0","0","0","0","0","0","0","0","0","3","5","https://www.altmetric.com/details/29692671","https://api.altmetric.com/v1/donut/29692671_240.png"
"151453","0","Maximally permissive controlled system synthesis for non-determinism and modal logic","Discrete Event Dynamic Systems","0924-6703"," 1573-7594","08 Information and Computing Sciences; 0802 Computation Theory and Mathematics","Eindhoven University of Technology; VU University Amsterdam","23-09-2016","10.1007/s10626-016-0231-8","0","0","0","0","0","0","0","0","0","0","0","0","0","0","0","0","0","4","1","https://www.altmetric.com/details/29691367","https://api.altmetric.com/v1/donut/29691367_240.png"
"151457","0","Ranking nodes in general networks: a Markov multi-chain approach","Discrete Event Dynamic Systems","0924-6703"," 1573-7594","15 Commerce, Management, Tourism and Services; 1503 Business and Management","Centrum Wiskunde and Informatica; VU University Amsterdam","27-05-2017","10.1007/s10626-017-0248-7","0","0","0","0","0","0","0","0","0","0","0","0","0","0","0","0","0","4","2","https://www.altmetric.com/details/29687035","https://api.altmetric.com/v1/donut/29687035_240.png"
"151505","0","Synchronization of a class of cyclic discrete-event systems describing legged locomotion","Discrete Event Dynamic Systems","0924-6703"," 1573-7594","08 Information and Computing Sciences; 0801 Artificial Intelligence and Image Processing","Delft University of Technology","20-02-2015","10.1007/s10626-014-0206-6","0","0","0","0","0","0","0","0","0","0","0","0","0","0","0","0","0","12","5","https://www.altmetric.com/details/28381681","https://api.altmetric.com/v1/donut/28381681_240.png"
"151510","0","VeriSiMPL 2: An open-source software for the verification of max-plus-linear systems","Discrete Event Dynamic Systems","0924-6703"," 1573-7594","08 Information and Computing Sciences; 0803 Computer Software","Delft University of Technology; Sepuluh Nopember Institute of Technology; University of Oxford","15-10-2015","10.1007/s10626-015-0218-x","0","0","0","0","0","0","0","0","0","0","0","0","0","0","0","0","0","12","2","https://www.altmetric.com/details/28368951","https://api.altmetric.com/v1/donut/28368951_240.png"
"151512","0","Towards railway traffic management using switching Max-plus-linear systems","Discrete Event Dynamic Systems","0924-6703"," 1573-7594","01 Mathematical Sciences; 0102 Applied Mathematics","Delft University of Technology; P?zm?ny P?ter Catholic University","24-12-2014","10.1007/s10626-014-0205-7","0","0","0","0","0","0","0","0","0","0","0","0","0","0","0","0","0","3","9","https://www.altmetric.com/details/28368096","https://api.altmetric.com/v1/donut/28368096_240.png"
