id,altmetric_score,title,journal_name,print_issn,online_issn,subjects,affiliation,publication_date,doi,news,blog,policy,patent,twitter,peer_review,weibo,facebook,wikipedia,google,linkedIn,reddit,pinterest,f1000,qa,videos,syllabi,mendeley,dimensions_citations,details_page,badge_url
"31135","8","The role of measurability in game-theoretic probability","Finance & Stochastics","0949-2984"," 1432-1122","14 Economics; 1402 Applied Economics","Royal Holloway University of London","07-06-2017","10.1007/s00780-017-0336-4","0","0","0","0","18","0","0","0","0","0","0","0","0","0","0","0","0","4","0","https://www.altmetric.com/details/6473669","https://api.altmetric.com/v1/donut/6473669_240.png"
"32108","4","Bounds for VIX futures given S&P 500 smiles","Finance & Stochastics","0949-2984"," 1432-1122","14 Economics; 1402 Applied Economics","Columbia University","07-06-2017","10.1007/s00780-017-0334-6","0","0","0","0","10","0","0","0","0","0","0","0","0","0","0","0","0","5","2","https://www.altmetric.com/details/20932523","https://api.altmetric.com/v1/donut/20932523_240.png"
"32294","4","Hybrid scheme for Brownian semistationary processes","Finance & Stochastics","0949-2984"," 1432-1122","01 Mathematical Sciences; 0104 Statistics","Aarhus University; Imperial College London","28-06-2017","10.1007/s00780-017-0335-5","0","0","0","0","10","0","0","0","0","0","0","0","0","0","0","0","0","23","17","https://www.altmetric.com/details/4267709","https://api.altmetric.com/v1/donut/4267709_240.png"
"32506","3","Optimal liquidation under stochastic liquidity","Finance & Stochastics","0949-2984"," 1432-1122","01 Mathematical Sciences; 0102 Applied Mathematics; 0104 Statistics","Humboldt University of Berlin","30-10-2017","10.1007/s00780-017-0346-2","0","0","0","0","19","0","0","3","0","0","0","0","0","0","0","0","0","53","4","https://www.altmetric.com/details/28491700","https://api.altmetric.com/v1/donut/28491700_240.png"
"33003","3","Equilibrium in risk-sharing games","Finance & Stochastics","0949-2984"," 1432-1122","01 Mathematical Sciences; 0104 Statistics","London School of Economics and Political Science; University of Piraeus","21-03-2017","10.1007/s00780-017-0323-9","0","0","0","0","4","0","0","0","0","0","0","0","0","0","0","0","0","8","2","https://www.altmetric.com/details/18005567","https://api.altmetric.com/v1/donut/18005567_240.png"
"33571","2","Market completion with derivative securities","Finance & Stochastics","0949-2984"," 1432-1122","01 Mathematical Sciences; 0104 Statistics","University College London","12-12-2016","10.1007/s00780-016-0317-z","0","0","0","0","4","0","0","0","0","0","0","0","0","0","0","0","0","9","2","https://www.altmetric.com/details/4079700","https://api.altmetric.com/v1/donut/4079700_240.png"
"33722","2","Continuous-time perpetuities and time reversal of diffusions","Finance & Stochastics","0949-2984"," 1432-1122","01 Mathematical Sciences; 0101 Pure Mathematics","Carnegie Mellon University; London School of Economics and Political Science","10-08-2016","10.1007/s00780-016-0308-0","0","0","0","0","2","0","0","0","0","0","0","0","0","0","0","0","0","1","2","https://www.altmetric.com/details/10671957","https://api.altmetric.com/v1/donut/10671957_240.png"
"34255","1","On dynamic spectral risk measures, a limit theorem and optimal portfolio allocation","Finance & Stochastics","0949-2984"," 1432-1122","01 Mathematical Sciences; 0104 Statistics","Imperial College London; University of Maryland, College Park; University of Ulm","16-08-2017","10.1007/s00780-017-0339-1","0","0","0","0","1","0","0","0","0","0","0","0","0","0","0","0","0","8","4","https://www.altmetric.com/details/23953936","https://api.altmetric.com/v1/donut/23953936_240.png"
"34317","1","Watermark options","Finance & Stochastics","0949-2984"," 1432-1122","15 Commerce, Management, Tourism and Services; 1502 Banking, Finance and Investment","London School of Economics and Political Science; Queen Mary University of London","06-12-2016","10.1007/s00780-016-0319-x","0","0","0","0","2","0","0","0","0","0","0","0","0","0","0","0","0","1","0","https://www.altmetric.com/details/15336940","https://api.altmetric.com/v1/donut/15336940_240.png"
"34404","1","The joint distribution of Parisian and hitting times of Brownian motion with application to Parisian option pricing","Finance & Stochastics","0949-2984"," 1432-1122","01 Mathematical Sciences; 0104 Statistics","London School of Economics and Political Science","02-06-2016","10.1007/s00780-016-0302-6","0","0","0","0","1","0","0","0","0","0","0","0","0","0","0","0","0","0","2","https://www.altmetric.com/details/9295432","https://api.altmetric.com/v1/donut/9295432_240.png"
"34896","1","Risk assessment for uncertain cash flows: model ambiguity, discounting ambiguity, and the role of bubbles","Finance & Stochastics","0949-2984"," 1432-1122","01 Mathematical Sciences; 0104 Statistics","Humboldt University of Berlin; University of Perugia","04-04-2012","10.1007/s00780-012-0176-1","0","0","0","0","1","0","0","0","0","0","0","0","0","0","0","0","0","17","22","https://www.altmetric.com/details/963812","https://api.altmetric.com/v1/donut/963812_240.png"
"34900","1","Optimal consumption and investment for markets with random coefficients","Finance & Stochastics","0949-2984"," 1432-1122","01 Mathematical Sciences; 0104 Statistics; 15 Commerce, Management, Tourism and Services; 1502 Banking, Finance and Investment","Laboratoire de Math?matiques Rapha?l Salem; Mouloud Mammeri University of Tizi-Ouzou; Tomsk State University; University of Rouen","05-09-2012","10.1007/s00780-012-0193-0","0","0","0","0","1","0","0","0","0","0","0","0","0","0","0","0","0","11","8","https://www.altmetric.com/details/941859","https://api.altmetric.com/v1/donut/941859_240.png"
"35217","1","Shadow prices, fractional Brownian motion, and portfolio optimisation under transaction costs","Finance & Stochastics","0949-2984"," 1432-1122","15 Commerce, Management, Tourism and Services; 1502 Banking, Finance and Investment","Centre de Math?matiques Appliqu?es; Institut ?lie Cartan de Lorraine; London School of Economics and Political Science; Swiss Federal Institute of Technology in Zurich; University of Vienna","17-11-2017","10.1007/s00780-017-0351-5","0","0","0","0","1","0","0","0","0","0","0","0","0","0","0","0","0","2","2","https://www.altmetric.com/details/31760119","https://api.altmetric.com/v1/donut/31760119_240.png"
"35303","1","The space of outcomes of semi-static trading strategies need not be closed","Finance & Stochastics","0949-2984"," 1432-1122","15 Commerce, Management, Tourism and Services; 1502 Banking, Finance and Investment","London School of Economics and Political Science; Swiss Federal Institute of Technology in Zurich; University of Vienna","30-05-2017","10.1007/s00780-017-0329-3","0","0","0","0","1","0","0","0","0","0","0","0","0","0","0","0","0","3","0","https://www.altmetric.com/details/20966430","https://api.altmetric.com/v1/donut/20966430_240.png"
"35872","1","Beyond cash-additive risk measures: when changing the num?raire fails","Finance & Stochastics","0949-2984"," 1432-1122","15 Commerce, Management, Tourism and Services; 1502 Banking, Finance and Investment","Swiss Federal Institute of Technology in Zurich; University of Zurich","29-11-2013","10.1007/s00780-013-0220-9","0","0","0","0","2","0","0","0","0","0","0","0","0","0","0","0","0","7","10","https://www.altmetric.com/details/1751485","https://api.altmetric.com/v1/donut/1751485_240.png"
"35925","1","Existence of an endogenously complete equilibrium driven by a diffusion","Finance & Stochastics","0949-2984"," 1432-1122"," ","Carnegie Mellon University","01-11-2014","10.1007/s00780-014-0250-y","0","0","0","0","1","0","0","1","0","0","0","0","0","0","0","0","0","4","9","https://www.altmetric.com/details/1387090","https://api.altmetric.com/v1/donut/1387090_240.png"
"36022","1","On arbitrages arising with honest times","Finance & Stochastics","0949-2984"," 1432-1122","14 Economics; 1402 Applied Economics","University of ?vry Val d'Essonne","03-04-2014","10.1007/s00780-014-0231-1","0","0","0","0","1","0","0","0","0","0","0","0","0","0","0","0","0","6","21","https://www.altmetric.com/details/860240","https://api.altmetric.com/v1/donut/860240_240.png"
"36202","1","RETRACTED ARTICLE: The distribution of the maximum of a variance gamma process and path-dependent option pricing","Finance & Stochastics","0949-2984"," 1432-1122","14 Economics; 1402 Applied Economics","Russian Academy of Sciences","30-09-2015","10.1007/s00780-015-0277-8","0","0","0","0","1","0","0","0","0","0","0","0","0","0","0","0","0","0","0","https://www.altmetric.com/details/26516423","https://api.altmetric.com/v1/donut/26516423_240.png"
"36617","1","Multi-portfolio time consistency for set-valued convex and coherent risk measures","Finance & Stochastics","0949-2984"," 1432-1122","15 Commerce, Management, Tourism and Services; 1502 Banking, Finance and Investment","Princeton University; Washington University in St. Louis","18-10-2014","10.1007/s00780-014-0247-6","0","0","0","0","1","0","0","0","0","0","0","0","0","0","0","0","0","4","11","https://www.altmetric.com/details/1690096","https://api.altmetric.com/v1/donut/1690096_240.png"
"36691","1","Outperformance portfolio optimization via the equivalence of pure and randomized hypothesis testing","Finance & Stochastics","0949-2984"," 1432-1122","01 Mathematical Sciences; 0104 Statistics","City University of Hong Kong; Columbia University; University of Illinois at Chicago","27-08-2013","10.1007/s00780-013-0213-8","0","0","0","0","0","0","0","1","0","0","0","0","0","0","0","0","0","8","3","https://www.altmetric.com/details/383873","https://api.altmetric.com/v1/donut/383873_240.png"
"36714","0","Robust pricing and hedging under trading restrictions and the emergence of local martingale models","Finance & Stochastics","0949-2984"," 1432-1122","01 Mathematical Sciences; 0104 Statistics; 14 Economics; 1402 Applied Economics; 1403 Econometrics; 15 Commerce, Management, Tourism and Services; 1502 Banking, Finance and Investment","University of Bath; University of Oxford","17-03-2016","10.1007/s00780-016-0293-3","0","0","0","0","0","0","0","0","0","0","0","0","0","0","0","0","0","4","8","https://www.altmetric.com/details/57299986","https://api.altmetric.com/v1/donut/57299986_240.png"
"36718","0","Robust pricing and hedging of double no-touch options","Finance & Stochastics","0949-2984"," 1432-1122","14 Economics; 1402 Applied Economics","University of Bath; University of Oxford","17-03-2011","10.1007/s00780-011-0154-z","0","0","0","0","0","0","0","0","0","0","0","0","0","0","0","0","0","22","49","https://www.altmetric.com/details/57287077","https://api.altmetric.com/v1/donut/57287077_240.png"
"36726","0","Optimal investment and contingent claim valuation in illiquid markets","Finance & Stochastics","0949-2984"," 1432-1122","14 Economics; 1402 Applied Economics; 15 Commerce, Management, Tourism and Services; 1502 Banking, Finance and Investment","King's College London","01-08-2014","10.1007/s00780-014-0240-0","0","0","0","0","0","0","0","0","0","0","0","0","0","0","0","0","0","12","12","https://www.altmetric.com/details/56590142","https://api.altmetric.com/v1/donut/56590142_240.png"
"36727","0","Pseudo linear pricing rule for utility indifference valuation","Finance & Stochastics","0949-2984"," 1432-1122","01 Mathematical Sciences; 0104 Statistics","King's College London; University of Oxford; University of Warwick","12-06-2014","10.1007/s00780-014-0235-x","0","0","0","0","0","0","0","0","0","0","0","0","0","0","0","0","0","0","5","https://www.altmetric.com/details/56588157","https://api.altmetric.com/v1/donut/56588157_240.png"
"36731","0","Bubbles and crashes in a Black?Scholes model with delay","Finance & Stochastics","0949-2984"," 1432-1122","01 Mathematical Sciences; 0104 Statistics","Dublin City University; King's College London","12-04-2012","10.1007/s00780-012-0181-4","0","0","0","0","0","0","0","0","0","0","0","0","0","0","0","0","0","16","1","https://www.altmetric.com/details/56579047","https://api.altmetric.com/v1/donut/56579047_240.png"
"36732","0","Correction note for ?The large-maturity smile for the Heston model?","Finance & Stochastics","0949-2984"," 1432-1122","15 Commerce, Management, Tourism and Services; 1502 Banking, Finance and Investment","Imperial College London; King's College London; University of Waterloo","30-08-2012","10.1007/s00780-012-0197-9","0","0","0","0","0","0","0","0","0","0","0","0","0","0","0","0","0","8","0","https://www.altmetric.com/details/56575939","https://api.altmetric.com/v1/donut/56575939_240.png"
"36967","0","Adapting extreme value statistics to financial time series: dealing with bias and serial dependence","Finance & Stochastics","0949-2984"," 1432-1122","14 Economics; 1403 Econometrics","Claude Bernard University Lyon 1; De Nederlandsche Bank; Erasmus University Rotterdam","06-01-2016","10.1007/s00780-015-0287-6","0","0","0","0","0","0","0","0","0","0","0","0","0","0","0","0","0","3","5","https://www.altmetric.com/details/45313536","https://api.altmetric.com/v1/donut/45313536_240.png"
"37099","0","Proving regularity of the minimal probability of ruin via a game of stopping and control","Finance & Stochastics","0949-2984"," 1432-1122","01 Mathematical Sciences; 0104 Statistics","University of Michigan?Ann Arbor","18-06-2011","10.1007/s00780-011-0160-1","0","0","0","0","0","0","0","0","0","0","0","0","0","0","0","0","0","6","10","https://www.altmetric.com/details/33014021","https://api.altmetric.com/v1/donut/33014021_240.png"
"37110","0","Tangent L?vy market models","Finance & Stochastics","0949-2984"," 1432-1122","01 Mathematical Sciences; 0102 Applied Mathematics","Princeton University; University of Oxford","17-05-2011","10.1007/s00780-011-0158-8","0","0","0","0","0","0","0","0","0","0","0","0","0","0","0","0","0","9","10","https://www.altmetric.com/details/32991643","https://api.altmetric.com/v1/donut/32991643_240.png"
"37133","0","Time-consistent stopping under decreasing impatience","Finance & Stochastics","0949-2984"," 1432-1122","14 Economics; 1401 Economic Theory","University of Colorado Boulder","09-11-2017","10.1007/s00780-017-0350-6","0","0","0","0","0","0","0","0","0","0","0","0","0","0","0","0","0","8","2","https://www.altmetric.com/details/32353425","https://api.altmetric.com/v1/donut/32353425_240.png"
"37140","0","An expansion in the model space in the context of utility maximization","Finance & Stochastics","0949-2984"," 1432-1122","14 Economics; 1402 Applied Economics; 15 Commerce, Management, Tourism and Services; 1502 Banking, Finance and Investment","Rutgers University; The University of Texas at Austin; University of Connecticut","14-12-2017","10.1007/s00780-017-0353-3","0","0","0","0","0","0","0","0","0","0","0","0","0","0","0","0","0","6","2","https://www.altmetric.com/details/32075522","https://api.altmetric.com/v1/donut/32075522_240.png"
"37148","0","Replicating portfolio approach to capital calculation","Finance & Stochastics","0949-2984"," 1432-1122","15 Commerce, Management, Tourism and Services; 1502 Banking, Finance and Investment","?cole Polytechnique F?d?rale de Lausanne","13-11-2017","10.1007/s00780-017-0347-1","0","0","0","0","0","0","0","0","0","0","0","0","0","0","0","0","0","4","2","https://www.altmetric.com/details/31939534","https://api.altmetric.com/v1/donut/31939534_240.png"
"37193","0","An enlargement of filtration formula with applications to multiple non-ordered default times","Finance & Stochastics","0949-2984"," 1432-1122","11 Medical and Health Sciences; 1102 Cardiorespiratory Medicine and Haematology","University of Paris-Saclay; UNSW Sydney","29-11-2017","10.1007/s00780-017-0349-z","0","0","0","0","0","0","0","0","0","0","0","0","0","0","0","0","0","1","0","https://www.altmetric.com/details/30609601","https://api.altmetric.com/v1/donut/30609601_240.png"
"37254","0","Financial equilibrium with asymmetric information and random horizon","Finance & Stochastics","0949-2984"," 1432-1122","14 Economics; 1402 Applied Economics","London School of Economics and Political Science","10-11-2017","10.1007/s00780-017-0348-0","0","0","0","0","0","0","0","0","0","0","0","0","0","0","0","0","0","5","1","https://www.altmetric.com/details/29640297","https://api.altmetric.com/v1/donut/29640297_240.png"
"37263","0","A BSDE approach to fair bilateral pricing under endogenous collateralization","Finance & Stochastics","0949-2984"," 1432-1122","01 Mathematical Sciences; 0104 Statistics","Shandong University; University of Sydney; Warsaw University of Technology","18-07-2016","10.1007/s00780-016-0306-2","0","0","0","0","0","0","0","0","0","0","0","0","0","0","0","0","0","7","6","https://www.altmetric.com/details/29571924","https://api.altmetric.com/v1/donut/29571924_240.png"
"37279","0","Time-consistent mean-variance portfolio selection in discrete and continuous time","Finance & Stochastics","0949-2984"," 1432-1122","14 Economics; 1402 Applied Economics","University of Vienna","03-07-2012","10.1007/s00780-012-0189-9","0","0","0","0","0","0","0","0","0","0","0","0","0","0","0","0","0","17","29","https://www.altmetric.com/details/29234853","https://api.altmetric.com/v1/donut/29234853_240.png"
"37284","0","On the existence of shadow prices","Finance & Stochastics","0949-2984"," 1432-1122","14 Economics; 1402 Applied Economics","Kiel University; Paris 13 University; Paris Dauphine University; Swiss Federal Institute of Technology in Zurich","19-12-2012","10.1007/s00780-012-0201-4","0","0","0","0","0","0","0","0","0","0","0","0","0","0","0","0","0","13","9","https://www.altmetric.com/details/29233672","https://api.altmetric.com/v1/donut/29233672_240.png"
"37289","0","Equilibrium model with default and dynamic insider information","Finance & Stochastics","0949-2984"," 1432-1122","14 Economics; 1402 Applied Economics; 15 Commerce, Management, Tourism and Services; 1502 Banking, Finance and Investment","London School of Economics and Political Science; Paris 13 University","05-09-2012","10.1007/s00780-012-0196-x","0","0","0","0","0","0","0","0","0","0","0","0","0","0","0","0","0","11","6","https://www.altmetric.com/details/29231692","https://api.altmetric.com/v1/donut/29231692_240.png"
"37290","0","Market viability via absence of arbitrage of the first kind","Finance & Stochastics","0949-2984"," 1432-1122","","Boston University","23-02-2012","10.1007/s00780-012-0172-5","0","0","0","0","0","0","0","0","0","0","0","0","0","0","0","0","0","5","36","https://www.altmetric.com/details/29231565","https://api.altmetric.com/v1/donut/29231565_240.png"
"37293","0","Strict local martingale deflators and valuing American call-type options","Finance & Stochastics","0949-2984"," 1432-1122","14 Economics; 1402 Applied Economics","Boston University; London School of Economics and Political Science; University of Michigan?Ann Arbor","17-03-2011","10.1007/s00780-011-0155-y","0","0","0","0","0","0","0","0","0","0","0","0","0","0","0","0","0","11","8","https://www.altmetric.com/details/29228115","https://api.altmetric.com/v1/donut/29228115_240.png"
"37307","0","On a Heath?Jarrow?Morton approach for stock options","Finance & Stochastics","0949-2984"," 1432-1122","15 Commerce, Management, Tourism and Services; 1502 Banking, Finance and Investment","Kiel University; TU Wien","08-07-2015","10.1007/s00780-015-0263-1","0","0","0","0","0","0","0","0","0","0","0","0","0","0","0","0","0","5","7","https://www.altmetric.com/details/28751246","https://api.altmetric.com/v1/donut/28751246_240.png"
"37325","0","Confidence sets in nonparametric calibration of exponential L?vy models","Finance & Stochastics","0949-2984"," 1432-1122","15 Commerce, Management, Tourism and Services; 1502 Banking, Finance and Investment","University of Cambridge","28-03-2014","10.1007/s00780-014-0228-9","0","0","0","0","0","0","0","0","0","0","0","0","0","0","0","0","0","3","2","https://www.altmetric.com/details/28343069","https://api.altmetric.com/v1/donut/28343069_240.png"
"37348","0","On the hedging of options on exploding exchange rates","Finance & Stochastics","0949-2984"," 1432-1122","14 Economics; 1402 Applied Economics","Courant Institute of Mathematical Sciences; University of Oxford","29-11-2013","10.1007/s00780-013-0218-3","0","0","0","0","0","0","0","0","0","0","0","0","0","0","0","0","0","13","24","https://www.altmetric.com/details/27300711","https://api.altmetric.com/v1/donut/27300711_240.png"
"37480","0","Duality and convergence for binomial markets with friction","Finance & Stochastics","0949-2984"," 1432-1122","15 Commerce, Management, Tourism and Services; 1502 Banking, Finance and Investment","Swiss Federal Institute of Technology in Zurich","10-07-2012","10.1007/s00780-012-0192-1","0","0","0","0","0","0","0","0","0","0","0","0","0","0","0","0","0","2","17","https://www.altmetric.com/details/23863779","https://api.altmetric.com/v1/donut/23863779_240.png"
"37481","0","Robust hedging with proportional transaction costs","Finance & Stochastics","0949-2984"," 1432-1122","15 Commerce, Management, Tourism and Services; 1502 Banking, Finance and Investment","Hebrew University of Jerusalem; Swiss Federal Institute of Technology in Zurich","04-03-2014","10.1007/s00780-014-0227-x","0","0","0","0","0","0","0","0","0","0","0","0","0","0","0","0","0","11","27","https://www.altmetric.com/details/23863776","https://api.altmetric.com/v1/donut/23863776_240.png"
"37528","0","Almost-sure hedging with permanent price impact","Finance & Stochastics","0949-2984"," 1432-1122","15 Commerce, Management, Tourism and Services; 1502 Banking, Finance and Investment","BNP Paribas (France); Centre De Recherche en Math?matiques de la D?cision","15-03-2016","10.1007/s00780-016-0295-1","0","0","0","0","0","0","0","0","0","0","0","0","0","0","0","0","0","4","6","https://www.altmetric.com/details/22337642","https://api.altmetric.com/v1/donut/22337642_240.png"
"37530","0","Arbitrage-free pricing of multi-person game claims in discrete time","Finance & Stochastics","0949-2984"," 1432-1122","01 Mathematical Sciences; 0104 Statistics","Monash University; University of Sydney; Warsaw University of Technology","18-11-2016","10.1007/s00780-016-0315-1","0","0","0","0","0","0","0","0","0","0","0","0","0","0","0","0","0","1","0","https://www.altmetric.com/details/22337256","https://api.altmetric.com/v1/donut/22337256_240.png"
"37533","0","The scaling limit of superreplication prices with small transaction costs in the multivariate case","Finance & Stochastics","0949-2984"," 1432-1122","15 Commerce, Management, Tourism and Services; 1502 Banking, Finance and Investment","Hebrew University of Jerusalem; Technical University of Berlin","02-12-2016","10.1007/s00780-016-0320-4","0","0","0","0","0","0","0","0","0","0","0","0","0","0","0","0","0","3","2","https://www.altmetric.com/details/22332405","https://api.altmetric.com/v1/donut/22332405_240.png"
"37601","0","Polynomial diffusions and applications in finance","Finance & Stochastics","0949-2984"," 1432-1122","01 Mathematical Sciences; 0101 Pure Mathematics; 0102 Applied Mathematics; 0104 Statistics; 15 Commerce, Management, Tourism and Services; 1502 Banking, Finance and Investment","?cole Polytechnique F?d?rale de Lausanne; Swiss Federal Institute of Technology in Zurich","14-06-2016","10.1007/s00780-016-0304-4","0","0","0","0","0","0","0","0","0","0","0","0","0","0","0","0","0","7","12","https://www.altmetric.com/details/21017538","https://api.altmetric.com/v1/donut/21017538_240.png"
"37618","0","Comonotone Pareto optimal allocations for law invariant robust utilities on L 1","Finance & Stochastics","0949-2984"," 1432-1122","18 Law and Legal Studies; 1801 Law","?cole Polytechnique F?d?rale de Lausanne; Ludwig Maximilian University of Munich","04-10-2013","10.1007/s00780-013-0214-7","0","0","0","0","0","0","0","0","0","0","0","0","0","0","0","0","0","1","4","https://www.altmetric.com/details/21007700","https://api.altmetric.com/v1/donut/21007700_240.png"
"37630","0","Trading strategies generated by Lyapunov functions","Finance & Stochastics","0949-2984"," 1432-1122","15 Commerce, Management, Tourism and Services; 1502 Banking, Finance and Investment","Columbia University; London School of Economics and Political Science","25-05-2017","10.1007/s00780-017-0332-8","0","0","0","0","0","0","0","0","0","0","0","0","0","0","0","0","0","9","4","https://www.altmetric.com/details/20968898","https://api.altmetric.com/v1/donut/20968898_240.png"
"37780","0","Model-independent superhedging under portfolio constraints","Finance & Stochastics","0949-2984"," 1432-1122","15 Commerce, Management, Tourism and Services; 1502 Banking, Finance and Investment","Dublin City University; Florida State University","11-11-2015","10.1007/s00780-015-0284-9","0","0","0","0","0","0","0","0","0","0","0","0","0","0","0","0","0","5","6","https://www.altmetric.com/details/15940891","https://api.altmetric.com/v1/donut/15940891_240.png"
"37783","0","Abstract, classic, and explicit turnpikes","Finance & Stochastics","0949-2984"," 1432-1122","15 Commerce, Management, Tourism and Services; 1502 Banking, Finance and Investment","Boston University; Carnegie Mellon University; Dublin City University; London School of Economics and Political Science","13-11-2013","10.1007/s00780-013-0216-5","0","0","0","0","0","0","0","0","0","0","0","0","0","0","0","0","0","8","7","https://www.altmetric.com/details/15847779","https://api.altmetric.com/v1/donut/15847779_240.png"
"37822","0","Change of numeraire in the two-marginals martingale transport problem","Finance & Stochastics","0949-2984"," 1432-1122","01 Mathematical Sciences; 0102 Applied Mathematics","London School of Economics and Political Science","28-12-2016","10.1007/s00780-016-0322-2","0","0","0","0","0","0","0","0","0","0","0","0","0","0","0","0","0","2","5","https://www.altmetric.com/details/15331321","https://api.altmetric.com/v1/donut/15331321_240.png"
