id,altmetric_score,title,journal_name,print_issn,online_issn,subjects,affiliation,publication_date,doi,news,blog,policy,patent,twitter,peer_review,weibo,facebook,wikipedia,google,linkedIn,reddit,pinterest,f1000,qa,videos,syllabi,mendeley,dimensions_citations,details_page,badge_url
"84532","0","Process flexibility and inventory flexibility via product substitution","Flexible Services and Manufacturing Journal","1936-6582"," 1936-6590","01 Mathematical Sciences; 0102 Applied Mathematics","Northwestern University; University of Alberta; University of Michigan?Ann Arbor","01-03-2012","10.1007/s10696-012-9142-7","0","0","0","0","0","0","0","0","0","0","0","0","0","0","0","0","0","13","5","https://www.altmetric.com/details/32934356","https://api.altmetric.com/v1/donut/32934356_240.png"
"84534","0","Strategic design of multiple lifecycle products for remanufacturing operations","IISE Transactions","2472-5854"," 2472-5862","14 Economics; 1402 Applied Economics","Clemson University; Texas A&M University","05-06-2017","10.1080/24725854.2017.1336684","0","0","0","0","0","0","0","0","0","0","0","0","0","0","0","0","0","10","6","https://www.altmetric.com/details/32931736","https://api.altmetric.com/v1/donut/32931736_240.png"
"84536","0","A sparse partitioned-regression model for nonlinear system?environment interactions","IISE Transactions","2472-5854"," 2472-5862","01 Mathematical Sciences; 0104 Statistics","Arizona State University; University of Michigan?Ann Arbor","01-03-2017","10.1080/24725854.2017.1299955","0","0","0","0","0","0","0","0","0","0","0","0","0","0","0","0","0","4","0","https://www.altmetric.com/details/32925740","https://api.altmetric.com/v1/donut/32925740_240.png"
"84556","0","The impact of lanes segmentation and booking levels on a container terminal gate congestion","Flexible Services and Manufacturing Journal","1936-6582"," 1936-6590","11 Medical and Health Sciences; 1117 Public Health and Health Services","Autonomous University of Tamaulipas","09-09-2016","10.1007/s10696-016-9256-4","0","0","0","0","0","0","0","0","0","0","0","0","0","0","0","0","0","18","6","https://www.altmetric.com/details/32187870","https://api.altmetric.com/v1/donut/32187870_240.png"
"84573","0","Designing a maritime supply chain for distribution of wood pellets: a case study from southern Norway","Flexible Services and Manufacturing Journal","1936-6582"," 1936-6590","09 Engineering; 0905 Civil Engineering","Enova (Norway); Norwegian University of Science and Technology","30-12-2016","10.1007/s10696-016-9269-z","0","0","0","0","0","0","0","0","0","0","0","0","0","0","0","0","0","15","2","https://www.altmetric.com/details/31716217","https://api.altmetric.com/v1/donut/31716217_240.png"
"84579","0","Maritime fleet deployment with voyage separation requirements","Flexible Services and Manufacturing Journal","1936-6582"," 1936-6590","01 Mathematical Sciences; 0103 Numerical and Computational Mathematics","Norwegian Marine Technology Research Institute; Norwegian University of Science and Technology","02-04-2013","10.1007/s10696-013-9174-7","0","0","0","0","0","0","0","0","0","0","0","0","0","0","0","0","0","15","9","https://www.altmetric.com/details/31714122","https://api.altmetric.com/v1/donut/31714122_240.png"
"84585","0","Analyzing complex service structures in liner shipping network design","Flexible Services and Manufacturing Journal","1936-6582"," 1936-6590","01 Mathematical Sciences; 0103 Numerical and Computational Mathematics","Norwegian University of Science and Technology","02-11-2016","10.1007/s10696-016-9262-6","0","0","0","0","0","0","0","0","0","0","0","0","0","0","0","0","0","22","7","https://www.altmetric.com/details/31711020","https://api.altmetric.com/v1/donut/31711020_240.png"
"84606","0","Spline model for wake effect analysis: Characteristics of a single wake and its impacts on wind turbine power generation","IISE Transactions","2472-5854"," 2472-5862","09 Engineering; 0915 Interdisciplinary Engineering","Texas A&M University","20-11-2017","10.1080/24725854.2017.1370176","0","0","0","0","0","0","0","0","0","0","0","0","0","0","0","0","0","4","1","https://www.altmetric.com/details/30465951","https://api.altmetric.com/v1/donut/30465951_240.png"
"84671","0","An overview and perspective on social network monitoring","IISE Transactions","2472-5854"," 2472-5862","01 Mathematical Sciences; 0104 Statistics","Georgia Institute of Technology; University of San Francisco; Virginia Tech","02-08-2016","10.1080/0740817x.2016.1213468","0","0","0","0","0","0","0","0","0","0","0","0","0","0","0","0","0","29","20","https://www.altmetric.com/details/29375344","https://api.altmetric.com/v1/donut/29375344_240.png"
"84691","0","Order batching in a bucket brigade order picking system considering picker blocking","Flexible Services and Manufacturing Journal","1936-6582"," 1936-6590","01 Mathematical Sciences; 0104 Statistics","Pusan National University; Texas A&M University; University of Wisconsin?Milwaukee","30-08-2015","10.1007/s10696-015-9223-5","0","0","0","0","0","0","0","0","0","0","0","0","0","0","0","0","0","23","10","https://www.altmetric.com/details/29028338","https://api.altmetric.com/v1/donut/29028338_240.png"
"84699","0","Accelerated process optimization for laser-based additive manufacturing by leveraging similar prior studies","IISE Transactions","2472-5854"," 2472-5862","09 Engineering; 0910 Manufacturing Engineering","","21-05-2016","10.1080/0740817x.2016.1189629","0","0","0","0","0","0","0","0","0","0","0","0","0","0","0","0","0","54","15","https://www.altmetric.com/details/28710923","https://api.altmetric.com/v1/donut/28710923_240.png"
"84700","0","Identifying multi-stage nanocrystal growth using in situ TEM video data","IISE Transactions","2472-5854"," 2472-5862","08 Information and Computing Sciences; 0801 Artificial Intelligence and Image Processing","Texas A&M University","26-10-2016","10.1080/24725854.2016.1251666","0","0","0","0","0","0","0","0","0","0","0","0","0","0","0","0","0","4","0","https://www.altmetric.com/details/28676915","https://api.altmetric.com/v1/donut/28676915_240.png"
"84706","0","Demand fulfillment probability in a multi-item inventory system with limited historical data","IISE Transactions","2472-5854"," 2472-5862","01 Mathematical Sciences; 0104 Statistics","Boston University; Carnegie Mellon University; General Electric (United States)","06-10-2017","10.1080/24725854.2017.1355125","0","0","0","0","0","0","0","0","0","0","0","0","0","0","0","0","0","1","1","https://www.altmetric.com/details/28526225","https://api.altmetric.com/v1/donut/28526225_240.png"
"84721","0","Equilibrium models in multimodal container transport systems","Flexible Services and Manufacturing Journal","1936-6582"," 1936-6590","09 Engineering; 0905 Civil Engineering","Delft University of Technology; KU Leuven; University of Luxembourg","04-09-2015","10.1007/s10696-015-9224-4","0","0","0","0","0","0","0","0","0","0","0","0","0","0","0","0","0","30","3","https://www.altmetric.com/details/28368517","https://api.altmetric.com/v1/donut/28368517_240.png"
"84723","0","An iterative optimization framework for delay management and train scheduling","Flexible Services and Manufacturing Journal","1936-6582"," 1936-6590","01 Mathematical Sciences; 0102 Applied Mathematics","Delft University of Technology; Erasmus University Rotterdam; KU Leuven; Roma Tre University","18-12-2013","10.1007/s10696-013-9187-2","0","0","0","0","0","0","0","0","0","0","0","0","0","0","0","0","0","25","57","https://www.altmetric.com/details/28365112","https://api.altmetric.com/v1/donut/28365112_240.png"
"84728","0","The Cargo Fare Class Mix problem for an intermodal corridor: revenue management in synchromodal container transportation","Flexible Services and Manufacturing Journal","1936-6582"," 1936-6590","10 Technology; 1005 Communications Technologies","Delft University of Technology; Erasmus University Rotterdam","16-03-2017","10.1007/s10696-017-9285-7","0","0","0","0","0","0","0","0","0","0","0","0","0","0","0","0","0","20","3","https://www.altmetric.com/details/28345183","https://api.altmetric.com/v1/donut/28345183_240.png"
"84741","0","An improved basket of spread options heuristic for merchant energy storage","IISE Transactions","2472-5854"," 2472-5862","14 Economics; 1402 Applied Economics","Carnegie Mellon University","09-08-2017","10.1080/24725854.2017.1336685","0","0","0","0","0","0","0","0","0","0","0","0","0","0","0","0","0","3","0","https://www.altmetric.com/details/27898012","https://api.altmetric.com/v1/donut/27898012_240.png"
"84774","0","Cruise itinerary schedule design","IISE Transactions","2472-5854"," 2472-5862","14 Economics; 1402 Applied Economics","Hong Kong Polytechnic University; Shanghai University; University of Technology Sydney","01-03-2017","10.1080/24725854.2017.1299954","0","0","0","0","0","0","0","0","0","0","0","0","0","0","0","0","0","6","2","https://www.altmetric.com/details/26315972","https://api.altmetric.com/v1/donut/26315972_240.png"
"84814","0","Real-time container storage location assignment at an RTG-based seaport container transshipment terminal: problem description, control system, simulation model, and penalty scheme experimentation","Flexible Services and Manufacturing Journal","1936-6582"," 1936-6590","08 Information and Computing Sciences; 0801 Artificial Intelligence and Image Processing","University of Wisconsin?Milwaukee","30-10-2013","10.1007/s10696-013-9183-6","0","0","0","0","0","0","0","0","0","0","0","0","0","0","0","0","0","22","14","https://www.altmetric.com/details/24127303","https://api.altmetric.com/v1/donut/24127303_240.png"
"84861","0","Fair allocation and cost-effective routing models for food rescue and redistribution","IISE Transactions","2472-5854"," 2472-5862","14 Economics; 1402 Applied Economics","UNSW Sydney","10-07-2017","10.1080/24725854.2017.1351043","0","0","0","0","0","0","0","0","0","0","0","0","0","0","0","0","0","13","3","https://www.altmetric.com/details/23053635","https://api.altmetric.com/v1/donut/23053635_240.png"
"84925","0","Enhancement of supply chain resilience through inter-echelon information sharing","Flexible Services and Manufacturing Journal","1936-6582"," 1936-6590","08 Information and Computing Sciences; 0801 Artificial Intelligence and Image Processing; 0806 Information Systems; 15 Commerce, Management, Tourism and Services; 1503 Business and Management","Institute of High Performance Computing; National University of Singapore","02-08-2016","10.1007/s10696-016-9249-3","0","0","0","0","0","0","0","0","0","0","0","0","0","0","0","0","0","43","5","https://www.altmetric.com/details/21363281","https://api.altmetric.com/v1/donut/21363281_240.png"
"84977","0","Optimization of maintenance policy under parameter uncertainty using portfolio theory","IISE Transactions","2472-5854"," 2472-5862","01 Mathematical Sciences; 0104 Statistics","City University of Hong Kong; Durham University; University of Kent","06-12-2016","10.1080/24725854.2016.1267881","0","0","0","0","0","0","0","0","0","0","0","0","0","0","0","0","0","10","7","https://www.altmetric.com/details/20248481","https://api.altmetric.com/v1/donut/20248481_240.png"
"85009","0","A solution approach for deriving alternative fuel station infrastructure requirements","Flexible Services and Manufacturing Journal","1936-6582"," 1936-6590","03 Chemical Sciences; 0306 Physical Chemistry (incl. Structural)","University of Groningen","21-04-2017","10.1007/s10696-017-9289-3","0","0","0","0","0","0","0","0","0","0","0","0","0","0","0","0","0","8","2","https://www.altmetric.com/details/19501316","https://api.altmetric.com/v1/donut/19501316_240.png"
"85034","0","Simultaneous buffer and service rate allocation in open finite queueing networks","","2472-5854"," 2472-5862","01 Mathematical Sciences; 0103 Numerical and Computational Mathematics","University of Massachusetts Amherst","06-06-2017","10.1080/24725854.2017.1300359","0","0","0","0","0","0","0","0","0","0","0","0","0","0","0","0","0","4","1","https://www.altmetric.com/details/18160104","https://api.altmetric.com/v1/donut/18160104_240.png"
"85159","0","Health care management","Flexible Services and Manufacturing Journal","1936-6582"," 1936-6590","","Queensland University of Technology; University of Southampton; University of Vienna","23-06-2012","10.1007/s10696-012-9155-2","0","0","0","0","0","0","0","0","0","0","0","0","0","0","0","0","0","10","5","https://www.altmetric.com/details/15541854","https://api.altmetric.com/v1/donut/15541854_240.png"
"85172","0","Inventory rationing for a system with heterogeneous customer classes","Flexible Services and Manufacturing Journal","1936-6582"," 1936-6590","14 Economics; 1402 Applied Economics","Carnegie Mellon University; Eindhoven University of Technology","15-05-2012","10.1007/s10696-012-9148-1","0","0","0","0","0","0","0","0","0","0","0","0","0","0","0","0","0","15","7","https://www.altmetric.com/details/15433277","https://api.altmetric.com/v1/donut/15433277_240.png"
"85231","0","Reactive scheduling model for the operating theatre","Flexible Services and Manufacturing Journal","1936-6582"," 1936-6590","08 Information and Computing Sciences; 0801 Artificial Intelligence and Image Processing","Queensland University of Technology","04-08-2011","10.1007/s10696-011-9111-6","0","0","0","0","0","0","0","0","0","0","0","0","0","0","0","0","0","37","13","https://www.altmetric.com/details/12925279","https://api.altmetric.com/v1/donut/12925279_240.png"
"85316","0","Modern heuristics for scheduling","Flexible Services and Manufacturing Journal","1936-6582"," 1936-6590","","Queensland University of Technology","17-05-2011","10.1007/s10696-011-9097-0","0","0","0","0","0","0","0","0","0","0","0","0","0","0","0","0","0","11","0","https://www.altmetric.com/details/11779880","https://api.altmetric.com/v1/donut/11779880_240.png"
"86950","0","A DSS for job scheduling under process interruptions","Flexible Services and Manufacturing Journal","1936-6582"," 1936-6590","08 Information and Computing Sciences; 0801 Artificial Intelligence and Image Processing","University of Lorraine; UNSW Sydney","24-04-2011","10.1007/s10696-011-9094-3","0","0","0","0","0","0","0","0","0","0","0","0","0","0","0","0","0","9","2","https://www.altmetric.com/details/8159965","https://api.altmetric.com/v1/donut/8159965_240.png"
"86951","0","A job-shop scheduling approach for optimising sugarcane rail operations","Flexible Services and Manufacturing Journal","1936-6582"," 1936-6590","08 Information and Computing Sciences; 0803 Computer Software","Queensland University of Technology","16-04-2011","10.1007/s10696-011-9092-5","0","0","0","0","0","0","0","0","0","0","0","0","0","0","0","0","0","9","9","https://www.altmetric.com/details/8159964","https://api.altmetric.com/v1/donut/8159964_240.png"
"86952","0","A note on liner ship fleet deployment","Flexible Services and Manufacturing Journal","1936-6582"," 1936-6590","09 Engineering; 0911 Maritime Engineering","National University of Singapore","12-03-2011","10.1007/s10696-011-9089-0","0","0","0","0","0","0","0","0","0","0","0","0","0","0","0","0","0","9","27","https://www.altmetric.com/details/8159962","https://api.altmetric.com/v1/donut/8159962_240.png"
"86953","0","Optimising a coal rail network under capacity constraints","Flexible Services and Manufacturing Journal","1936-6582"," 1936-6590","01 Mathematical Sciences; 0102 Applied Mathematics","Queensland University of Technology","04-01-2011","10.1007/s10696-010-9069-9","0","0","0","0","0","0","0","0","0","0","0","0","0","0","0","0","0","16","14","https://www.altmetric.com/details/8159961","https://api.altmetric.com/v1/donut/8159961_240.png"
"86991","0","An artificial immune system algorithm for the resource availability cost problem","Flexible Services and Manufacturing Journal","1936-6582"," 1936-6590","11 Medical and Health Sciences; 1107 Immunology","EDHEC Business School; Ghent University; University College London; Vlerick Business School","02-10-2011","10.1007/s10696-011-9117-0","0","0","0","0","0","0","0","0","0","0","0","0","0","0","0","0","0","27","12","https://www.altmetric.com/details/7840960","https://api.altmetric.com/v1/donut/7840960_240.png"
"87087","0","Seaside operations in container terminals: literature overview, trends, and research directions","Flexible Services and Manufacturing Journal","1936-6582"," 1936-6590","08 Information and Computing Sciences; 0801 Artificial Intelligence and Image Processing","University of Groningen; University of Puerto Rico at Mayag?ez","02-06-2013","10.1007/s10696-013-9178-3","0","0","0","0","0","0","0","0","0","0","0","0","0","0","0","0","0","23","71","https://www.altmetric.com/details/7387192","https://api.altmetric.com/v1/donut/7387192_240.png"
"99827","7","Definitive Screening Designs with Added Two-Level Categorical Factors","Journal of Quality Technology","0022-4065","","14 Economics; 1403 Econometrics","Statistical Analysis System Institute (United States); University of Minnesota","21-11-2017","10.1080/00224065.2013.11917921","1","0","0","0","0","0","0","0","0","0","0","0","0","0","0","0","0","66","34","https://www.altmetric.com/details/55792283","https://api.altmetric.com/v1/donut/55792283_240.png"
"99831","7","Next Editor of the Journal of Quality Technology Dr. Fugee Tsung","Journal of Quality Technology","0022-4065","","","","21-11-2017","10.1080/00224065.2015.11918101","1","0","0","0","0","0","0","0","0","0","0","0","0","0","0","0","0","0","0","https://www.altmetric.com/details/30449472","https://api.altmetric.com/v1/donut/30449472_240.png"
"100945","3","System Monitoring with Real-Time Contrasts","Journal of Quality Technology","0022-4065","","08 Information and Computing Sciences; 0801 Artificial Intelligence and Image Processing","Arizona State University; Intuit (United States)","21-11-2017","10.1080/00224065.2012.11917878","0","0","0","0","0","0","0","0","2","0","0","0","0","0","0","0","0","32","17","https://www.altmetric.com/details/55755825","https://api.altmetric.com/v1/donut/55755825_240.png"
"100946","3","Lateral Collinearity and Misleading Results in Variance-Based SEM: An Illustration and Recommendations","Journal of the Association for Information Systems","1536-9323"," 1558-3457","","","01-07-2012","10.17705/1jais.00302","0","0","0","0","0","0","0","0","1","0","0","0","0","0","0","0","0","421","197","https://www.altmetric.com/details/55568920","https://api.altmetric.com/v1/donut/55568920_240.png"
"100948","3","Work System Theory: Overview of Core Concepts, Extensions, and Challenges for the Future","Journal of the Association for Information Systems","1536-9323"," 1558-3457","","","01-02-2013","10.17705/1jais.00323","0","0","0","0","0","0","0","0","1","0","0","0","0","0","0","0","0","195","69","https://www.altmetric.com/details/55425894","https://api.altmetric.com/v1/donut/55425894_240.png"
"100949","3","Big Data Research in Information Systems: Toward an Inclusive Research Agenda","Journal of the Association for Information Systems","1536-9323"," 1558-3457","","","01-02-2016","10.17705/1jais.00423","0","0","1","0","0","0","0","0","0","0","0","0","0","0","0","0","0","399","95","https://www.altmetric.com/details/55412047","https://api.altmetric.com/v1/donut/55412047_240.png"
"100970","3","Constructing Definitive Screening Designs Using Conference Matrices","Journal of Quality Technology","0022-4065","","09 Engineering; 0905 Civil Engineering","Pennsylvania State University; Tsinghua University","21-11-2017","10.1080/00224065.2012.11917877","0","0","0","0","0","0","0","0","1","0","0","0","0","0","0","0","0","15","37","https://www.altmetric.com/details/51779084","https://api.altmetric.com/v1/donut/51779084_240.png"
"100982","3","Validity Issues in the Use of Social Network Analysis with Digital Trace Data","Journal of the Association for Information Systems","1536-9323"," 1558-3457","","","01-12-2011","10.17705/1jais.00282","0","0","0","1","0","0","0","0","0","0","0","0","0","0","0","0","0","203","65","https://www.altmetric.com/details/49737690","https://api.altmetric.com/v1/donut/49737690_240.png"
"101009","3","A Class of Three-Level Designs for Definitive Screening in the Presence of Second-Order Effects","Journal of Quality Technology","0022-4065","","17 Psychology and Cognitive Sciences; 1701 Psychology","Statistical Analysis System Institute (United States); University of Minnesota","21-11-2017","10.1080/00224065.2011.11917841","0","0","0","1","0","0","0","0","0","0","0","0","0","0","0","0","0","131","128","https://www.altmetric.com/details/42983382","https://api.altmetric.com/v1/donut/42983382_240.png"
"101022","3","Taking ?Fun and Games? Seriously: Proposing the Hedonic-Motivation System Adoption Model (HMSAM)","Journal of the Association for Information Systems","1536-9323"," 1558-3457","","","01-11-2013","10.17705/1jais.00347","0","0","0","0","0","0","0","0","3","0","0","0","0","0","0","0","0","257","63","https://www.altmetric.com/details/35075516","https://api.altmetric.com/v1/donut/35075516_240.png"
"103454","1","Flipping the Context: ICT4D, the Next Grand Challenge for IS Research and Practice","Journal of the Association for Information Systems","1536-9323"," 1558-3457","","","01-12-2017","10.17705/1jais.00479","0","0","0","0","1","0","0","0","0","0","0","0","0","0","0","0","0","26","3","https://www.altmetric.com/details/33113258","https://api.altmetric.com/v1/donut/33113258_240.png"
"105269","0","Evidence-Based Information Systems: A New Perspective and a Road Map for Research-Informed Practice","Journal of the Association for Information Systems","1536-9323"," 1558-3457","","","01-01-2018","10.17705/1jais.00519","0","0","0","0","0","0","0","0","0","0","0","0","0","0","0","0","0","11","0","https://www.altmetric.com/details/57173486","https://api.altmetric.com/v1/donut/57173486_240.png"
"105271","0","Planning Fatigue Tests for Polymer Composites","Journal of Quality Technology","0022-4065","","09 Engineering; 0912 Materials Engineering","Arizona State University; Eastman Chemical Company (United States); Virginia Tech","21-11-2017","10.1080/00224065.2016.11918163","0","0","0","0","0","0","0","0","0","0","0","0","0","0","0","0","0","7","3","https://www.altmetric.com/details/56838652","https://api.altmetric.com/v1/donut/56838652_240.png"
"105280","0","Testing for Lack of Fit in Blocked, Split-Plot, and Other Multi-Stratum Designs","Journal of Quality Technology","0022-4065","","04 Earth Sciences; 0406 Physical Geography and Environmental Geoscience","","21-11-2017","10.1080/00224065.2017.11918000","0","0","0","0","0","0","0","0","0","0","0","0","0","0","0","0","0","0","1","https://www.altmetric.com/details/56598156","https://api.altmetric.com/v1/donut/56598156_240.png"
"105379","0","Trust Across Borders: Buyer-Supplier Trust in Global Business-to-Business E-Commerce","Journal of the Association for Information Systems","1536-9323"," 1558-3457","","","01-11-2012","10.17705/1jais.00316","0","0","0","0","0","0","0","0","0","0","0","0","0","0","0","0","0","0","10","https://www.altmetric.com/details/50212746","https://api.altmetric.com/v1/donut/50212746_240.png"
"105435","0","Measurement System Analysis for Binary Inspection: Continuous Versus Dichotomous Measurands","Journal of Quality Technology","0022-4065","","01 Mathematical Sciences; 0104 Statistics","University of Amsterdam; VU University Amsterdam","21-11-2017","10.1080/00224065.2011.11917849","0","0","0","0","0","0","0","0","0","0","0","0","0","0","0","0","0","6","14","https://www.altmetric.com/details/47059043","https://api.altmetric.com/v1/donut/47059043_240.png"
"105556","0","Cluster-Based Profile Analysis in Phase I","Journal of Quality Technology","0022-4065","","08 Information and Computing Sciences; 0801 Artificial Intelligence and Image Processing","Virginia Tech","21-11-2017","10.1080/00224065.2015.11918103","0","0","0","0","0","0","0","0","0","0","0","0","0","0","0","0","0","6","5","https://www.altmetric.com/details/44524742","https://api.altmetric.com/v1/donut/44524742_240.png"
"105557","0","An Overview of Phase I Analysis for Process Improvement and Monitoring","Journal of Quality Technology","0022-4065","","01 Mathematical Sciences; 0102 Applied Mathematics","Georgia Southern University; Miami University; University of Waterloo; Virginia Tech","21-11-2017","10.1080/00224065.2014.11917969","0","0","0","0","0","0","0","0","0","0","0","0","0","0","0","0","0","36","77","https://www.altmetric.com/details/44523229","https://api.altmetric.com/v1/donut/44523229_240.png"
"105558","0","The Difficulty in Designing Shewhart X? and X Control Charts with Estimated Parameters","Journal of Quality Technology","0022-4065","","01 Mathematical Sciences; 0102 Applied Mathematics","Cairo University; Virginia Tech","21-11-2017","10.1080/00224065.2015.11918120","0","0","0","0","0","0","0","0","0","0","0","0","0","0","0","0","0","19","58","https://www.altmetric.com/details/44523228","https://api.altmetric.com/v1/donut/44523228_240.png"
"105559","0","Another Look at the EWMA Control Chart with Estimated Parameters","Journal of Quality Technology","0022-4065","","01 Mathematical Sciences; 0102 Applied Mathematics","Cairo University; Miami University; University of Amsterdam; Virginia Tech","21-11-2017","10.1080/00224065.2015.11918140","0","0","0","0","0","0","0","0","0","0","0","0","0","0","0","0","0","27","51","https://www.altmetric.com/details/44523225","https://api.altmetric.com/v1/donut/44523225_240.png"
"105560","0","The Monitoring and Improvement of Surgical-Outcome Quality","Journal of Quality Technology","0022-4065","","11 Medical and Health Sciences; 1117 Public Health and Health Services","University of Waterloo; Virginia Tech","21-11-2017","10.1080/00224065.2015.11918141","0","0","0","0","0","0","0","0","0","0","0","0","0","0","0","0","0","20","20","https://www.altmetric.com/details/44523224","https://api.altmetric.com/v1/donut/44523224_240.png"
