id,altmetric_score,title,journal_name,print_issn,online_issn,subjects,affiliation,publication_date,doi,news,blog,policy,patent,twitter,peer_review,weibo,facebook,wikipedia,google,linkedIn,reddit,pinterest,f1000,qa,videos,syllabi,mendeley,dimensions_citations,details_page,badge_url
"151514","0","Exact and approximate approaches to the identification of stochastic max-plus-linear systems","Discrete Event Dynamic Systems","0924-6703"," 1573-7594","01 Mathematical Sciences; 0102 Applied Mathematics","Delft University of Technology","16-04-2013","10.1007/s10626-013-0164-4","0","0","0","0","0","0","0","0","0","0","0","0","0","0","0","0","0","3","5","https://www.altmetric.com/details/28356161","https://api.altmetric.com/v1/donut/28356161_240.png"
"151518","0","On a generalization of power algorithms over max-plus algebra","Discrete Event Dynamic Systems","0924-6703"," 1573-7594","01 Mathematical Sciences; 0101 Pure Mathematics","Delft University of Technology; Sepuluh Nopember Institute of Technology","12-01-2017","10.1007/s10626-016-0235-4","0","0","0","0","0","0","0","0","0","0","0","0","0","0","0","0","0","5","0","https://www.altmetric.com/details/28345696","https://api.altmetric.com/v1/donut/28345696_240.png"
"151519","0","Towards scalable synthesis of stochastic control systems","Discrete Event Dynamic Systems","0924-6703"," 1573-7594","01 Mathematical Sciences; 0102 Applied Mathematics","Delft University of Technology; Technical University Munich; University of Oxford","22-11-2016","10.1007/s10626-016-0233-6","0","0","0","0","0","0","0","0","0","0","0","0","0","0","0","0","0","2","3","https://www.altmetric.com/details/28345371","https://api.altmetric.com/v1/donut/28345371_240.png"
"151536","0","Modelling and collaboration across organizations: Issues and a solution","Concurrent Engineering: Research & Applications","1063-293X"," 1531-2003","08 Information and Computing Sciences; 0806 Information Systems","","04-09-2017","10.1177/1063293x17727045","0","0","0","0","0","0","0","0","0","0","0","0","0","0","0","0","0","8","0","https://www.altmetric.com/details/27540962","https://api.altmetric.com/v1/donut/27540962_240.png"
"151570","0","Including product features in process redesign","Concurrent Engineering: Research & Applications","1063-293X"," 1531-2003","15 Commerce, Management, Tourism and Services; 1503 Business and Management","Technical University of Denmark; University of Southern Denmark","04-09-2017","10.1177/1063293x17727327","0","0","0","0","0","0","0","0","0","0","0","0","0","0","0","0","0","17","0","https://www.altmetric.com/details/25136658","https://api.altmetric.com/v1/donut/25136658_240.png"
"151602","0","A framework for complex product architecture analysis using an integrated approach","Concurrent Engineering: Research & Applications","1063-293X"," 1531-2003","08 Information and Computing Sciences; 0806 Information Systems","COMSATS Institute of Information Technology; University of Bradford; University of Engineering and Technology Lahore","26-07-2016","10.1177/1063293x16647434","0","0","0","0","0","0","0","0","0","0","0","0","0","0","0","0","0","6","3","https://www.altmetric.com/details/23470362","https://api.altmetric.com/v1/donut/23470362_240.png"
"151712","0","Process-waste reduction in the construction supply chain using proactive information network","Concurrent Engineering: Research & Applications","1063-293X"," 1531-2003","15 Commerce, Management, Tourism and Services; 1503 Business and Management","Curtin University; Federico Santa Mar?a Technical University; Kyung Hee University; Swinburne University of Technology; University of Seoul","18-09-2016","10.1177/1063293x16667451","0","0","0","0","0","0","0","0","0","0","0","0","0","0","0","0","0","15","7","https://www.altmetric.com/details/21350201","https://api.altmetric.com/v1/donut/21350201_240.png"
"151726","0","Development of product platforms: Theory and methodology","Concurrent Engineering: Research & Applications","1063-293X"," 1531-2003","08 Information and Computing Sciences; 0806 Information Systems","Chalmers University of Technology","05-06-2017","10.1177/1063293x17709866","0","0","0","0","0","0","0","0","0","0","0","0","0","0","0","0","0","22","1","https://www.altmetric.com/details/21092736","https://api.altmetric.com/v1/donut/21092736_240.png"
"151869","0","Automatic as-built modeling for concurrent progress tracking of plant construction based on laser scanning","Concurrent Engineering: Research & Applications","1063-293X"," 1531-2003","08 Information and Computing Sciences; 0801 Artificial Intelligence and Image Processing","Curtin University; Kyung Hee University; Pusan National University","12-12-2016","10.1177/1063293x16670449","0","0","0","0","0","0","0","0","0","0","0","0","0","0","0","0","0","11","5","https://www.altmetric.com/details/17174969","https://api.altmetric.com/v1/donut/17174969_240.png"
"152739","0","Dynamic group communication for large-scale parallel data mining","Concurrent Engineering: Research & Applications","1063-293X"," 1531-2003","08 Information and Computing Sciences; 0801 Artificial Intelligence and Image Processing; 0802 Computation Theory and Mathematics; 0803 Computer Software; 0806 Information Systems","University of Reading","01-08-2013","10.1177/1063293x13495551","0","0","0","0","0","0","0","0","0","0","0","0","0","0","0","0","0","4","0","https://www.altmetric.com/details/9849953","https://api.altmetric.com/v1/donut/9849953_240.png"
"153058","0","Mixed integer programming in production planning with backlogging and setup carryover: modeling and algorithms","Discrete Event Dynamic Systems","0924-6703"," 1573-7594","08 Information and Computing Sciences; 0802 Computation Theory and Mathematics","Peking University; University of Strathclyde; University of Wisconsin?Madison","05-07-2012","10.1007/s10626-012-0141-3","0","0","0","0","0","0","0","0","0","0","0","0","0","0","0","0","0","14","11","https://www.altmetric.com/details/6682331","https://api.altmetric.com/v1/donut/6682331_240.png"
"153253","0","Investigating the impact of changes in iteration-likelihoods on design process performance","Concurrent Engineering: Research & Applications","1063-293X"," 1531-2003","08 Information and Computing Sciences; 0806 Information Systems","Siemens (Germany); University of Cambridge","17-06-2015","10.1177/1063293x15588202","0","0","0","0","0","0","0","0","0","0","0","0","0","0","0","0","0","19","5","https://www.altmetric.com/details/5503510","https://api.altmetric.com/v1/donut/5503510_240.png"
"153260","0","Impacts of concurrency, iteration, design review, and problem complexity on design project lead time and error generation","Concurrent Engineering: Research & Applications","1063-293X"," 1531-2003","17 Psychology and Cognitive Sciences; 1701 Psychology","University of Cambridge","02-02-2012","10.1177/1063293x11435177","0","0","0","0","0","0","0","0","0","0","0","0","0","0","0","0","0","28","7","https://www.altmetric.com/details/5486892","https://api.altmetric.com/v1/donut/5486892_240.png"
"153275","0","Change prediction using interface data","Concurrent Engineering: Research & Applications","1063-293X"," 1531-2003","08 Information and Computing Sciences; 0806 Information Systems","McGill University; University of Cambridge","21-06-2013","10.1177/1063293x13482473","0","0","0","0","0","0","0","0","0","0","0","0","0","0","0","0","0","37","16","https://www.altmetric.com/details/5406126","https://api.altmetric.com/v1/donut/5406126_240.png"
"154654","6","Roadmap for implementation of BIM in the UK construction industry","Engineering Construction & Architectural Management (09699988)","0969-9988"," 1365-232X","15 Commerce, Management, Tourism and Services; 1503 Business and Management","Leeds Beckett University; University of Salford","09-11-2012","10.1108/09699981211277531","0","0","1","0","4","0","0","0","0","0","0","0","0","0","0","0","0","467","79","https://www.altmetric.com/details/12081786","https://api.altmetric.com/v1/donut/12081786_240.png"
"154662","6","Implementing sustainability in small and medium-sized construction firms","Engineering Construction & Architectural Management (09699988)","0969-9988"," 1365-232X","15 Commerce, Management, Tourism and Services; 1503 Business and Management","Loughborough University","18-07-2016","10.1108/ecam-01-2015-0015","0","0","0","0","8","0","0","0","0","0","0","0","0","0","0","0","0","60","8","https://www.altmetric.com/details/5950295","https://api.altmetric.com/v1/donut/5950295_240.png"
"155022","4","Using BIM capabilities to improve existing building energy modelling practices","Engineering Construction & Architectural Management (09699988)","0969-9988"," 1365-232X","12 Built Environment and Design; 1202 Building","Loughborough University","20-03-2017","10.1108/ecam-11-2015-0181","0","0","1","0","2","0","0","0","0","0","0","0","0","0","0","0","0","86","8","https://www.altmetric.com/details/5946705","https://api.altmetric.com/v1/donut/5946705_240.png"
"155556","3","Adoption of Building Information Modelling technology (BIM)","Engineering Construction & Architectural Management (09699988)","0969-9988"," 1365-232X","15 Commerce, Management, Tourism and Services; 1503 Business and Management","Curtin University; University of Technology Malaysia","20-07-2015","10.1108/ecam-05-2014-0067","0","0","1","0","0","0","0","0","0","0","0","0","0","0","0","0","0","2","31","https://www.altmetric.com/details/17201637","https://api.altmetric.com/v1/donut/17201637_240.png"
"155633","3","Changing roles of the clients, architects and contractors through BIM","Engineering Construction & Architectural Management (09699988)","0969-9988"," 1365-232X","08 Information and Computing Sciences; 0806 Information Systems","Netherlands Organisation for Applied Scientific Research","01-03-2011","10.1108/09699981111111148","0","0","1","0","0","0","0","0","0","0","0","0","0","0","0","0","0","374","84","https://www.altmetric.com/details/13960558","https://api.altmetric.com/v1/donut/13960558_240.png"
"156965","2","Improving performance of construction projects","Engineering Construction & Architectural Management (09699988)","0969-9988"," 1365-232X","15 Commerce, Management, Tourism and Services; 1503 Business and Management","Tianjin University","22-02-2013","10.1108/09699981311303044","0","0","0","0","2","0","0","0","0","0","0","0","0","0","0","0","0","140","21","https://www.altmetric.com/details/2400711","https://api.altmetric.com/v1/donut/2400711_240.png"
"157138","2","Managing the health risks of extreme weather events by managing hospital infrastructure","Engineering Construction & Architectural Management (09699988)","0969-9988"," 1365-232X","15 Commerce, Management, Tourism and Services; 1503 Business and Management","UNSW Sydney","14-01-2014","10.1108/ecam-10-2012-0060","0","0","0","0","2","0","0","1","0","0","0","0","0","0","0","0","0","16","6","https://www.altmetric.com/details/2030681","https://api.altmetric.com/v1/donut/2030681_240.png"
"157233","1","The professionals? perspective on the causes of project delay in the construction industry","Engineering Construction & Architectural Management (09699988)","0969-9988"," 1365-232X","11 Medical and Health Sciences; 1117 Public Health and Health Services","Coventry University; Nottingham Trent University","18-09-2017","10.1108/ecam-03-2016-0085","0","0","0","0","1","0","0","0","0","0","0","0","0","0","0","0","0","60","4","https://www.altmetric.com/details/41411989","https://api.altmetric.com/v1/donut/41411989_240.png"
"157293","1","Designers? performance evaluation in construction projects","Engineering Construction & Architectural Management (09699988)","0969-9988"," 1365-232X","08 Information and Computing Sciences; 0806 Information Systems","Aalto University","16-01-2017","10.1108/ecam-06-2015-0101","0","0","0","0","2","0","0","0","0","0","0","0","0","0","0","0","0","56","5","https://www.altmetric.com/details/24620756","https://api.altmetric.com/v1/donut/24620756_240.png"
"157380","1","A deterministic contractor selection decision support system for competitive bidding","Engineering Construction & Architectural Management (09699988)","0969-9988"," 1365-232X","08 Information and Computing Sciences; 0806 Information Systems","University of Balamand","16-01-2017","10.1108/ecam-06-2015-0094","0","0","0","0","1","0","0","0","0","0","0","0","0","0","0","0","0","30","7","https://www.altmetric.com/details/16118606","https://api.altmetric.com/v1/donut/16118606_240.png"
"157382","1","Effects of a major disaster on skills shortages in the construction industry","Engineering Construction & Architectural Management (09699988)","0969-9988"," 1365-232X","15 Commerce, Management, Tourism and Services; 1503 Business and Management","University of Auckland; University of Canterbury","16-01-2017","10.1108/ecam-03-2014-0044","0","0","0","0","1","0","0","0","0","0","0","0","0","0","0","0","0","26","1","https://www.altmetric.com/details/16077363","https://api.altmetric.com/v1/donut/16077363_240.png"
"157509","1","Climate and construction delays: case study in Chile","Engineering Construction & Architectural Management (09699988)","0969-9988"," 1365-232X","11 Medical and Health Sciences; 1117 Public Health and Health Services","Polytechnic University of Valencia; University of Talca","16-11-2015","10.1108/ecam-02-2015-0024","0","0","0","0","3","0","0","0","0","0","0","0","0","0","0","0","0","56","11","https://www.altmetric.com/details/8504496","https://api.altmetric.com/v1/donut/8504496_240.png"
"157785","1","Causal ascription of rework in building and civil engineering projects","Engineering Construction & Architectural Management (09699988)","0969-9988"," 1365-232X","09 Engineering; 0905 Civil Engineering","Curtin University; Swinburne University of Technology; University of Hong Kong","14-01-2014","10.1108/ecam-04-2010-0029","0","0","0","0","1","0","0","0","0","0","0","0","0","0","0","0","0","25","4","https://www.altmetric.com/details/2456581","https://api.altmetric.com/v1/donut/2456581_240.png"
"157875","1","The how and why of plant?related fatalities in the Australian construction industry","Engineering Construction & Architectural Management (09699988)","0969-9988"," 1365-232X","11 Medical and Health Sciences; 1117 Public Health and Health Services","RMIT University; Swinburne University of Technology","28-06-2013","10.1108/ecam-09-2011-0085","0","0","0","0","1","0","0","0","0","0","0","0","0","0","0","0","0","16","1","https://www.altmetric.com/details/1595237","https://api.altmetric.com/v1/donut/1595237_240.png"
"158160","1","Enhanced project brief: structured approach to client-designer interface","Engineering Construction & Architectural Management (09699988)","0969-9988"," 1365-232X","08 Information and Computing Sciences; 0801 Artificial Intelligence and Image Processing; 0803 Computer Software","","21-09-2015","10.1108/ecam-10-2014-0128","0","0","0","0","2","0","0","0","0","0","0","0","0","0","0","0","0","37","1","https://www.altmetric.com/details/4970351","https://api.altmetric.com/v1/donut/4970351_240.png"
"158796","1","Ethics management for the construction industry","Engineering Construction & Architectural Management (09699988)","0969-9988"," 1365-232X","15 Commerce, Management, Tourism and Services; 1503 Business and Management; 22 Philosophy and Religious Studies; 2203 Philosophy","Hong Kong Polytechnic University","06-09-2011","10.1108/09699981111165194","0","0","0","0","1","0","0","0","0","0","0","0","0","0","0","0","0","55","18","https://www.altmetric.com/details/3722529","https://api.altmetric.com/v1/donut/3722529_240.png"
"159106","1","Organizational learning in construction supply chains","Engineering Construction & Architectural Management (09699988)","0969-9988"," 1365-232X","15 Commerce, Management, Tourism and Services; 1503 Business and Management","Loughborough University; University of the West of Scotland","04-01-2013","10.1108/09699981311288691","0","0","0","0","1","0","0","0","0","0","0","0","0","0","0","0","0","119","11","https://www.altmetric.com/details/1131263","https://api.altmetric.com/v1/donut/1131263_240.png"
"159107","1","Research assessment and the activity hypothesis","Engineering Construction & Architectural Management (09699988)","0969-9988"," 1365-232X","14 Economics; 1402 Applied Economics","University of Reading","04-01-2013","10.1108/09699981311288655","0","0","0","0","1","0","0","0","0","0","0","0","0","0","0","0","0","2","0","https://www.altmetric.com/details/1131262","https://api.altmetric.com/v1/donut/1131262_240.png"
"159108","1","A portrait of building services engineers in Hong Kong","Engineering Construction & Architectural Management (09699988)","0969-9988"," 1365-232X","11 Medical and Health Sciences; 1117 Public Health and Health Services","Hong Kong Polytechnic University","04-01-2013","10.1108/09699981311288682","0","0","0","0","1","0","0","0","0","0","0","0","0","0","0","0","0","15","3","https://www.altmetric.com/details/1131260","https://api.altmetric.com/v1/donut/1131260_240.png"
"159109","1","Meeting sustainability challenges of mega?event flagships","Engineering Construction & Architectural Management (09699988)","0969-9988"," 1365-232X","16 Studies in Human Society; 1605 Policy and Administration","University of Hong Kong","04-01-2013","10.1108/09699981311288673","0","0","0","0","2","0","0","0","0","0","0","0","0","0","0","0","0","26","2","https://www.altmetric.com/details/1131259","https://api.altmetric.com/v1/donut/1131259_240.png"
"159589","1","Determining the relationship between conflict factors and performance of international construction projects","Engineering Construction & Architectural Management (09699988)","0969-9988"," 1365-232X","15 Commerce, Management, Tourism and Services; 1503 Business and Management","University of Malaya","15-07-2014","10.1108/ecam-03-2014-0034","0","0","0","0","0","0","0","1","0","0","0","0","0","0","0","0","0","53","8","https://www.altmetric.com/details/2850189","https://api.altmetric.com/v1/donut/2850189_240.png"
"159633","1","Strategies for potential owners in Singapore to own environmentally sustainable homes","Engineering Construction & Architectural Management (09699988)","0969-9988"," 1365-232X","11 Medical and Health Sciences; 1117 Public Health and Health Services","National University of Singapore","08-11-2011","10.1108/09699981111180890","0","0","0","0","0","0","0","0","0","0","0","0","0","0","0","1","0","37","8","https://www.altmetric.com/details/1885212","https://api.altmetric.com/v1/donut/1885212_240.png"
"159885","0","The health and safety impact of construction project features","Engineering Construction & Architectural Management (09699988)","0969-9988"," 1365-232X","11 Medical and Health Sciences; 1117 Public Health and Health Services","City, University of London; University of the West of England; University of Wolverhampton","14-01-2014","10.1108/ecam-07-2012-0070","0","0","0","0","0","0","0","0","0","0","0","0","0","0","0","0","0","74","9","https://www.altmetric.com/details/53429394","https://api.altmetric.com/v1/donut/53429394_240.png"
"160006","0","Empirical comparison of critical success factors for public-private partnerships in developing and developed countries","Engineering Construction & Architectural Management (09699988)","0969-9988"," 1365-232X","15 Commerce, Management, Tourism and Services; 1503 Business and Management; 16 Studies in Human Society; 1605 Policy and Administration; 1608 Sociology","Hong Kong Polytechnic University","20-11-2017","10.1108/ecam-06-2016-0144","0","0","0","0","0","0","0","0","0","0","0","0","0","0","0","0","0","16","7","https://www.altmetric.com/details/47229680","https://api.altmetric.com/v1/donut/47229680_240.png"
"160182","0","An integrated model for factors affecting construction and demolition waste management in Iran","Engineering Construction & Architectural Management (09699988)","0969-9988"," 1365-232X","11 Medical and Health Sciences; 1117 Public Health and Health Services","Deakin University; Iran University of Science and Technology; RMIT University; University of South Australia","20-11-2017","10.1108/ecam-01-2016-0015","0","0","0","0","0","0","0","0","0","0","0","0","0","0","0","0","0","21","6","https://www.altmetric.com/details/35035964","https://api.altmetric.com/v1/donut/35035964_240.png"
"160204","0","Estimating transaction costs in the New Zealand construction procurement","Engineering Construction & Architectural Management (09699988)","0969-9988"," 1365-232X","15 Commerce, Management, Tourism and Services; 1503 Business and Management","Auckland University of Technology","16-03-2015","10.1108/ecam-10-2014-0130","0","0","0","0","0","0","0","0","0","0","0","0","0","0","0","0","0","28","6","https://www.altmetric.com/details/33811879","https://api.altmetric.com/v1/donut/33811879_240.png"
"160235","0","Implementation of best-value procurement for highway design and construction in the USA","Engineering Construction & Architectural Management (09699988)","0969-9988"," 1365-232X","14 Economics; 1402 Applied Economics","University of Colorado Boulder; University of Kansas","18-09-2017","10.1108/ecam-03-2016-0073","0","0","0","0","0","0","0","0","0","0","0","0","0","0","0","0","0","10","1","https://www.altmetric.com/details/32674131","https://api.altmetric.com/v1/donut/32674131_240.png"
"160244","0","Different perspectives of public project managers on project success","Engineering Construction & Architectural Management (09699988)","0969-9988"," 1365-232X","15 Commerce, Management, Tourism and Services; 1503 Business and Management","Delft University of Technology","20-11-2017","10.1108/ecam-01-2015-0007","0","0","0","0","0","0","0","0","0","0","0","0","0","0","0","0","0","28","3","https://www.altmetric.com/details/32292020","https://api.altmetric.com/v1/donut/32292020_240.png"
"160249","0","Building information modelling for facility management: are we there yet?","Engineering Construction & Architectural Management (09699988)","0969-9988"," 1365-232X","08 Information and Computing Sciences; 0806 Information Systems","Deakin University; RMIT University; University of South Australia","20-11-2017","10.1108/ecam-06-2016-0139","0","0","0","0","0","0","0","0","0","0","0","0","0","0","0","0","0","86","6","https://www.altmetric.com/details/32161159","https://api.altmetric.com/v1/donut/32161159_240.png"
"160253","0","Construction safety and health problems of ethnic minority workers in Hong Kong","Engineering Construction & Architectural Management (09699988)","0969-9988"," 1365-232X","11 Medical and Health Sciences; 1117 Public Health and Health Services; 15 Commerce, Management, Tourism and Services; 1503 Business and Management","Hong Kong Polytechnic University; Queensland University of Technology; University of Hong Kong","20-11-2017","10.1108/ecam-09-2015-0143","0","0","0","0","0","0","0","0","0","0","0","0","0","0","0","0","0","21","4","https://www.altmetric.com/details/32106837","https://api.altmetric.com/v1/donut/32106837_240.png"
"160329","0","Challenges and barriers to establishing infrastructure asset management","Engineering Construction & Architectural Management (09699988)","0969-9988"," 1365-232X","11 Medical and Health Sciences; 1117 Public Health and Health Services","Polytechnic University of Valencia; University of Colorado Boulder","20-11-2017","10.1108/ecam-12-2015-0200","0","0","0","0","0","0","0","0","0","0","0","0","0","0","0","0","0","7","0","https://www.altmetric.com/details/31687158","https://api.altmetric.com/v1/donut/31687158_240.png"
"160331","0","Organisational culture of Chinese construction organisations in Kuwait","Engineering Construction & Architectural Management (09699988)","0969-9988"," 1365-232X","15 Commerce, Management, Tourism and Services; 1503 Business and Management","Australian College of Kuwait; University of Tasmania","20-11-2017","10.1108/ecam-07-2016-0157","0","0","0","0","0","0","0","0","0","0","0","0","0","0","0","0","0","10","0","https://www.altmetric.com/details/31550996","https://api.altmetric.com/v1/donut/31550996_240.png"
"160351","0","The role of customers and vendors in modern construction equipment technology diffusion","Engineering Construction & Architectural Management (09699988)","0969-9988"," 1365-232X","15 Commerce, Management, Tourism and Services; 1503 Business and Management","UNSW Sydney","20-11-2017","10.1108/ecam-06-2016-0149","0","0","0","0","0","0","0","0","0","0","0","0","0","0","0","0","0","16","4","https://www.altmetric.com/details/30614276","https://api.altmetric.com/v1/donut/30614276_240.png"
"160359","0","The nature of qualitative construction partnering research: literature review","Engineering Construction & Architectural Management (09699988)","0969-9988"," 1365-232X","17 Psychology and Cognitive Sciences; 1701 Psychology","Delft University of Technology; University of Applied Sciences Utrecht","20-11-2017","10.1108/ecam-04-2016-0098","0","0","0","0","0","0","0","0","0","0","0","0","0","0","0","0","0","15","0","https://www.altmetric.com/details/30209116","https://api.altmetric.com/v1/donut/30209116_240.png"
"160365","0","Managing engineering contractors in the UK petrochemicals industry","Engineering Construction & Architectural Management (09699988)","0969-9988"," 1365-232X","15 Commerce, Management, Tourism and Services; 1503 Business and Management","Lincoln University","20-11-2017","10.1108/ecam-08-2015-0127","0","0","0","0","0","0","0","0","0","0","0","0","0","0","0","0","0","6","0","https://www.altmetric.com/details/29923335","https://api.altmetric.com/v1/donut/29923335_240.png"
